"id","parsedContent"
"Blog_지름신_201701_4033","살아가다 필요 필요 이거 개인 따르다 같다 사다 평생 궁핍 느끼다 보다 기억 없다 생각 보다 고등 학교 하다 싶다 없다 대학교 이후 벌다 하다 싶다 하다 충분하다 때문 알다 어른 김창옥 선생 말씀 정서 허기 느끼다 물건 없다 고프다 느끼다 이야기 듣다 결혼 탄탄 살아오다 느끼다 음식 쓰다 돌아가다 있다 건전지 물건 대하다 욕심 없다 기계 욕심 있다 소지섭 광고 소니 광고 보다 저것 가지다 하다 마음 먹다 과외 벌다 사다 쓰다 쓰다 있다 소비 하다 드다 생각 필요 가이다 필요 필요 않다 갖다 싶다 사다 사다 후회 없다 그러다 정서 허기 느끼다 없다 같다 결혼 하다 아이 낳다 육아 휴직 기간 우울증 같다 필요 물건 사다 찌다 아이 키우다 대하다 무지 불안 불안 아이 위하다 사다 물건 해소 주다 믿다 하다 과자 좋아하다 군것질 하다 그러다 찌다 그때 찌다 빠지다 운동 하다 지나다 빠지다 않다 블로그 시작 빠지다 음식 정서 관련 있다 같다 살아가다 필요 필요 생각 보다 필요 모으다 무엇 하다 하다 우리 남매 지금 나름 사다 결혼 하다 언니 오빠 사다 은행 소유주 보다 되다 언니 오빠 벌다 갚다 사다 있다 안정 관련 있다 사다 생각 집값 오르다 내리다 문제 떠나다 있다 좋다 생각 지나다 아빠 제사 부산 가다 부산 집값 오르다 이야기 듣다 절망 희망 없다 보이다 때문 대하다 생각 보다 결과 희망 무궁무진하다 사다 처음 인형 눈알 붙이다 같다 부업 알다 보다 빠르다 하다 있다 같다 그러다 차다 크다 하다 재밌다 생각 하다 어리다 시절 엄마 양복 바느질 실밥 떼다 아르바이트 하다 용돈 벌다 좋다 추억 스다 어리다 시절 우리 부모 그러다 하다 있다 같다 한참 티비 보다 하다 갖다 싶다 하다 설명 하다 주다 엄마 장난감 사다 아깝다 대신 미술 수업 하다 장난감 사다 미술 선생 오다 말다 하다 묻다 받다 드리다 하다 돈돈 차다 비싸다 싫다 하다 처음 스다 부산 가다 세배 받다 오다 부산 가다 싶다 가다 무엇 바라다 되다 같다 가다 부담 되다 보다 알다 이것 사람 사다 블로그 처음 하다 재미 느끼다 사다 같다 행복 생각 하다 블로그 하다 좋다 하다 추억 있다 사람 연락 하다 블로그 보다 대화 하다 좋다 그러다 보다 주변 좋다 사람 많다 느끼다 스다 형제 만들다 주다 없다 좋다 하다 많다 사람 우리 스다 보다 주다 의미 있다 좋다 사람 세상 따뜻하다 만들다 좋다 생각 애드센스 인정 하다 주다 인정받다 벌다 되다 성당 기부 생각 하다 행복 않다 원인 찾아보다 그것 만약 없다 생각 보다 가능 욕심 가능 접다 하다 지금 세우다 안정 보다 가능 않다 있다 사람 벌어지다 대하다 후회 하다 못하다 대하다 미련 가다 시간 중요 생각 시간 하다 오다 목표 되다 되다 필요 생각 시간 쓰다 보다 시간 흐르다 해결 있다 많다 쉬다 싶다 쉬다 무엇 생각 나다 그거 대부분 시간 벌이다 만드다 욕심 가능 많다 욕심 버리다 재밌다 행동 만들다 보다 순위 재미 재밌다 정의 좋다 우리 모두 하루하루 되다 좋다 수기 개똥철학 카테고리 수기 수다 츤데레 관하다 수기 수다 휴식 관하다 수기 수다 관하다 수기 수다 미안 대하다 수기 수다 김어준 관하다 뮤지컬 팬텀"
"Blog_지름신_201701_4037","진심 죽다 하다 지나다 이러다 죽다 싶다 시간 지나가다 사람 살다 죽다 가다 있다 자다 발표 수업 준비 가다 되다 일상 사진 소원 잠자다 언제 사진 모르다 이것 다가오다 불행 주말 수업 수업 듣다 그것 하루 크리스마스 선물 니트 입다 기다리다 주다 예쁘다 제자 다가오다 미래 모르다 고투 스타 수업 마치다 나다 일요일 저녁 로고 예쁘다 나오다 만족 하다 아이 가르치다 만나다 중허다 교대 수업 듣다 수업 가다 마치다 과제 새다 주다 버티다 아침 넘어가다 좋다 하다 라떼 먹다 가다 시간 없다 지나다 시간 연락 하다 하다 못하다 결국 독감 코피 그러다 시간 지나가다 힘들다 치열 사다 사람 많다 세상 힘들다 사다 제주도 가족 여행 가다 새벽 제출 하다 과제 때문 결국 가다 편하다 놀다 같다 오다 예쁘다 오다 행복 하다 우리 이번 학기 수고 달다 여유 없다 촉박 바쁘다 하다 하다 많다 힘들다 교대 기간 휴대폰 보다 시간 없다 휴강 시간 행복 하다 행복 마음먹다 달리다 크다 거창하다 화려하다 인생 전부 받다 운동 지름신 티스 사망 엄동설한 신다 다니다 직구 걸리다 오다 아이 신다 편하다 초이스 보다 놀래다 켜다 사람 없다 얼굴 늙다 발표 아프다 죽다 낑낑대다 가다 내스 성경 우리 아프다 골골대다 결국 뻗다 걱정 주다 우리 문의 댓글 올리다 사진 없다 요즘 카페 어디 사람 지다 모습 연휴 보내다 생존 신고 오다"
"Blog_지름신_201701_4044","자연 소소 일상 도마 도착 복사 본문 기타 기능 번역 보다 스목 공방 도마 공구 하다 받다 주방 도구 지름신 이것 제어 되다 포장 깔끔하다 보내다 주다 도마 받침 예술 도마 예쁘다 칼질 겁나다 받침대 도마 올리다 보다 뿌듯하다 시간 있다 행복 이유 무엇 좋다 꾸다 상쾌하다 아침 맞이하다"
"Blog_지름신_201701_4046","세븐일레븐 하다 시작 도라에몽 페스티벌 이벤트 알다 계시다 아다 그동안 외면 있다 그렇다 이유 있다 세븐일레븐 상품 구매 도라에몽 상품 구매 파다 이벤트 하다 있다 과거 세븐일레븐 미키 마우스 넘다 털리다 경험 있다 이번 참여 말다 결심 이것 예전 사다 세븐일레븐 미키 전래 귀엽다 후회 않다 저녁 들어가다 들르다 세븐일레븐 도라에몽 꽂히다 충동 구매 하다 되다 괜찮다 사다 도라에몽 사다 위하다 구입 편의점 간식거리 포스팅 하다 순식간 쓰다 버리다 쓰다 세상 쉽다 떨리다 박스 개봉 이때 하다 비닐 뚫리다 구멍 노란색 보이다 도라미 노랑 도라에몽 나오다 생각 등장 느낌 도라에몽 이상 사다 하다 지름신 막다 주다 고맙다"
"Blog_지름신_201701_4048","늘어지다 자구 먹다 준비 나오다 날씨 풀리다 기분 좋다 친구 중요 마지막 시험 끝나다 선물 준비 고민 바닐라 가다 지름신 도지다 희희 크림 샘플 받다 쓰다 보다 좋다 구경 이번 지르다 버리다 정신 차리다 친구 선물 사다 있다 친구 좋다 소식 들리다 주다 선물 하다 나다 편안 지다 되다 알다 친구 간절하다 기도 응답 받다 같다 좋다 선물 축하 선물 되다 좋다 하다 주다 좋다 케이스 깔끔하다 좋다 이번 나오다 콜라보 하다 모르다 강추 담다 아영 만나다 얘기 놀다 아영 페퍼로니 먹다 싶다 가다 들어가다 미국 먹다 나오다 한국 오다 미국 느낌 피자 맛있다 좋다 아영 먹다 좋다 아영 행복 모습 좋다 행복 지다 오다 영어 공부 하다 되다 같다 미국 가다 싶다 교육 듣다 입사 싫다 웨이팅 하다 주다 라라 랜드 보다 이후 오빠 가다 서부 여행 그립다 블로그 서부 여행 기록 먹다 소화 구경 오다 예전 좋다 비타민 통이 아영 만나다 에너지 빵빵하다 지다 오늘 명언 남기다 주다 상황 사람 좋다 누구 있다 좋다 나쁘다 있다 주다 나쁘다 상황 벗어나다 돕다 주다 응원 주다 사람 놓치다 되다 주다 사람 놓치다 되다 생각 갖다 하다 주다 우리 많다 대화 하다 기억 두다 싶다 과거 우리 꿈꾸다 오다 보다 하다 나가다 있다 변하다 서로 좋다 영향 끼치다 느끼다 감사 통이 좋다 추억 만들다 우리 조급하다 하다 말다 준비 기다리다 이루다 지다 믿다 우리 마음 간절하다 지다 기다리다 문장 감사 편하다 부족 없다 있다 만족 감사 하다 있다 절실하다 감사 알다 하나님 주다 깨닫다 요즘 시작 좋다 블로그 일기 시작 좋다 주위 사람 사람 되다 주다"
"Blog_지름신_201701_4049","올해 친구 하다 얘기 있다 건강 챙기다 온몸 올해 무엇 먹다 프로 먹방 프로 덩이 자취생 취약 단백질 섭취 하다 보다 하다 사다 사다 하다 지름신 강림 보이다 대로 담다 생각 모르다 많다 개인 찌찌 싫다 하다 퍽퍽하다 없다 빠지다 요리 좋다 하다 가슴살 가다 우리 안성맞춤 제품 소세지 이름 보이다 청양 고추 구요 리얼 커리 커리 나다 편의점 파다 핫바 담백하다 깔끔하다 건강 지다 같다 이번 주문 아몬 호두 소시지 넘다 궁금하다 손이 가다 쿠팡 구매 가로 정도 가격 먹다 있다 편의점 이상 주다 사먹다 프로 다이어터 양심 나트륨 제품 가슴살 소시지 헬스 다니다 근육 늘다 힘들다 교대근무 잦다 회식 잦다 굶다 병행 쉬다 운동 의지 불태우다 피부 젊음 탱이 가다 그때 트레이너 가슴살 소세지 추천 주다 조절 말다 먹다 말다 단백질 섭취 먹다 그때 허닭 제품 먹다 보다 소시지 먹다 물리다 다음 가슴살 큐브 주문 이것 이러다 넘다 작다 같다 반찬 먹다 전자 렌지 들다 쓰다 있다 버터 굽다 이것 마나 맛있다 배송 하다 서다 연휴 먹다 하다 오다 물다 있다 집안 들여놓다 개봉 택배 뜯다 기쁨 모르다 박스 뜯다 귀찮다 활용 생기다 버리다 상품 오다 귀찮다 좋다 간단하다 조리법 적히다 설명서 동봉 있다 하루 개봉 아이 얼다 있다 기특하다 자식 먹다 전자 렌지 돌리다 들다 끓다 있다 드다 기름 후라이팬 익히다 기름 두르다 후라이팬 익히다 출근 전자 렌지 리릭 하다 가위 자르다 먹다 볶은밥 파스타 베이컨 대신 썰다 넣다 올리브유 버터 굽다 먹다 하다 다이어트 필요 먹다 간식 고구마 계란 우유 말리다 과일 파인애플 레몬 자몽 우려 조금 먹다 말리다 과일 레몽 제품 보다 어머니 만들다 주다 알차다 덕분 냉장실 냉동실 정리 하다 저기 버섯 가슴살 스테이크 강추 버섯 좋다 하다 저것 쏘다 스테이 씹다 촉감 오다 후라이팬 버터 풀다 두르다 스테이 하다 저염식 하다 꺼내다 먹다 칠리소스 저거 오다 없다 저거 끄다 대다 옴팡지다 시리다 사진 나오다 보다 핸드폰 렌즈 만지다 뿌다 정리 넣다 손가락 옴팡지다 시리다 냉동 제품 사다 유통 기한 짧다 낭패 보다 경험 있다 오리고기 훈제 오리고기 유통 기한 확인 뒤집다 확인 나름 녀다 날짜 제각각 먹다 싶다 빼다 두다 하다 돼다 담백하다 오리지날 가슴살 요리 넣다 먹다 하다 맛있다 보이다 않다 드레싱 소스 유통 기한 짧다 칠리소스 그러다 길다 키위 드레싱 과일 유통 기한 짧다 확인 쓰다 보다 배고프다 고구마 큐브 뜯다 신생아 푸른똥 냄새 먹다 보다 냄새 나다 맛있다 신기하다 촉촉하다 하다 건강 지다 두유 하다 제품 자세 설명 아임 홈페이지 확인 쏘다 가슴살 특가 다양 경품 이벤트 빠르다 배송"
"Blog_지름신_201701_4058","체험 국민 아기 베개 도노 도노 에어 필로우 메이즈 레터 복사 본문 기타 기능 번역 보다 국민 아기 베개 유아 베개 도노 도노 에어 필로우 얼마 아들 보금자리 도노 도노 범퍼 침대 사다 쓰다 있다 저기 자기 자리 알다 자다 들어가다 하다 저기 서다 눕다 신기하다 기특하다 범퍼 침대 사다 나다 베개 사야 이불 사야 매트 사야 베개 사다 결정 유아 베개 사용 지금 아들 베개 재우다 되다 가다 요즘 이제 아기 베개 필요 느낌 그러다 유아 베개 아들 베개 도노 도노 에어 필로우 결정 커버 디자인 메이즈 레터 도착 뿌다 아들 머리 많다 보다 일반 베개 도노 도노 에어 필로우 결정 노도 에어 필로우 계절 잠자리 유지 주다 찾다 베개 우리 아들 맞다 유아 베개 어필 포근하다 수면 환경 마이크로솜 미세 섬유 세균 번식 방지 우수 통기성 잠자리 제공 쿠션 복원력 매쉬 완벽 쿠션 유지 보다 통기성 좋다 보이다 구멍 기능 있다 세균 번식 방지 진드기 저리 커버 디자인 가지전 메이즈 레터 공원 연상 하다 디자인 커버 소재 마이크 세제 찌꺼기 남다 않다 원단 손상 적다 실크 부드럽다 감촉 은은하다 광택 원단 일반 건조 빠르다 커버 마이크로솜 베개 넣다 아기 베개 완성 아들 보다 눕다 보다 하다 좋다 눕다 귀요미 자기 지다 귀신 아다 같다 엉성하다 같다 이쁘다 보이다 아들 공간 아들 바디 필로우 뺏다 가다 저것 안다 자다 대신 좁다 지다 시키다 않다 저렇다 가다 눕다 시늉 베개 들어가다 운필 마이크로 공기 함유량 높다 거위 부럽다 하다 복원력 뛰어나다 포근하다 수면 환경 빼다 넣다 하다 높낮이 조절 가능 꿀잠 울다 아들 넘다 사랑 도노 도노 범퍼 침대 도노 도노 에어 필로우 베개 다음 패드 마련 도노 도노 계절 낮잠 이불 나오다 그거 사다 나다 틀다 다음 지름신 오다 만나다 유아 베개 아들 베개 도노 도노 에어 필로우 대만 해당 업체 할인 혜택 받다 작성"
"Blog_지름신_201701_4061","일상 우왕 블로그 탄생 복사 본문 기타 기능 번역 보다 우왕 블로그 입성 아침 먹다 우리 가족 사랑 쳐다보다 우리 막내 공주 뽀다 포켓몬 잡다 산책로 솜뭉치 발견 포켓볼 들어오다 주다 되다 애기 발걸음 넘다 귀엽다 부대 신호 잡히다 이거 하다 맞다 싶다 부모 우리 잡다 세상 행복 여기 요번 평일 일상 친구 크리스마스 주다 라이언 인형 근무 오프 병원 신세계백화점 가다 지름신 오다 지르다 주다 요물 예쁘다 주다 먹다 치즈 타르트 빠지다 맛있다 먹다 자나다 가다 먹다 오다 빛나다 목요일 아침 계란 라이 조류 독감 인하다 소시지 바끼다 조아 사먹다 그릇 먹다 먹다 나이 서운하다 이러다 있다 빛나다 손톱 처음 네일 받다 보다 정리 그림 넣다 네일 아트 받다 보다 싶다 소원 소원 인생 무상 사랑 사람 많다 사랑 노래 부르다 싶다 어리다 밤하늘 은하수 잊히다 지다 않다 인가 열다 정유 새해 우리 가족 건강 소망 풀리다 좋다 새해 마니 받다"
"Blog_지름신_201701_4062","다이어트 다이어트 맛있다 식사 우바 밀크티 복사 본문 기타 기능 번역 보다 포켓몬 잡다 돌아다니다 동생 올리브 갈일 있다 올리브 올리브 가다 지름신 오다 요즘 관심사 다이어트 다이어트 식품 있다 매대 둘러보다 발견 제품 타다 마시다 되다 간단하다 저녁 간단하다 먹다 끌리다 구매 가격 우바 밀크티 기억 안남 무튼 개다 쇼콜라 녹차 밀크티 거트 있다 기억 안남 무튼 어제 밀크티 먹다 파다 모르다 밀크티 생기다 미숫가루 생김 넘다 호감 가다 생기다 디자인 맛있다 보임 빠지다 같다 긋다 지다 있다 표시 담다 다음 마시다 되다 챙기다 먹다 귀찮다 하다 사람 이것 먹다 빠지다 기대 뚜껑 여니 우리 아다 밀크티 풍기다 지다 나오다 상온 두다 넣다 녹다 비주얼 밀크티 뚜껑 닫다 정도 겁나다 마시다 보다 외면 나중 오다 핥다 대기 나다 기본 밀크티 나다 먹다 보다 예전 다이어트 만들다 먹다 두부 쉐이크 두부 들깨 우유 입맛 기준 맛있다 먹다 생각 포만감 들다 그렇다 불구하다 소고기 먹다 제품 먹다 버티다 같다 칼로리다 정도 요즘 다이어트 대체 식품 되다 있다 같다 살빼다 어렵다 다이어트 식품 동일 제품 의존 않다 본인 맞다 다이어트 방법 찾다 중요 같다 궁금하다 사다 먹다 보다 예정 오랜만 나가다 운동 상쾌하다 기분 좋다 포켓몬 잡히다 잡념 사라지다 노래 들다 있다 운동장 아무 없다 세내다 같다 기분 하다 시간 뛰다 걷다 다이어트 화이팅 우바 밀크티 간단하다 먹다 심플 식사"
"Blog_지름신_201701_4065","원룸 인테리어 선인장 배달 구미 꽃집 밍크 선인장 복사 본문 기타 기능 번역 보다 요즘 인기 있다 카페 보다 감성 분위기 시크 매력 뽐내다 선인장 보다 있다 같다 덕분 특유 아름답다 빠지다 키우다 보다 싶다 생각 식물 기르다 싶다 허브 키우다 보다 있다 관리 생각 힘들다 날씨 다양 환경 조건 때문 실패 경험 많다 같다 하다 다육 오다 선인장 관리 비교 쉽다 스투키 키우다 보다 되다 마음 들다 계속 화분 꾸미다 싶다 마음 전국 선인장 배달 구미 꽃집 플라워 밍크 만나다 보다 되다 택배 다양 물건 구매 보다 식물 처음 같다 인터넷 구하다 없다 무엇 대단하다 같다 기다리다 오다 택배 도착 설레다 임반 걱정 박스 뜯어보다 박스 열다 수북 신문지 빼곡하다 채우다 지다 있다 사진 윗부분 겉다 내다 모습 보이다 솜털 같다 보이다 모습 신문지 제거 큼직하다 싸이다 있다 모습 보이다 박스 꺼내다 박스 박스 안전 도착 부분 신문지 흐르다 내림 무사 말리다 있다 휴지 제거 안전 장치 포장 제거 만나다 보다 있다 같다 선인장 흰색 시크 묘하다 매력 뽐내다 있다 싱기 방기 흰색 부드럽다 촉감 느끼다 있다 박스 보다 화분 받침 안전 포장 되다 있다 화분 받침 세트 완성 무광 블랙 화분 심플 하다 집안 어울리다 들다 멋지다 분위기 연출 주다 포인트 인테리어 효과 만들다 주다 있다 같다 있다 이쁘다 화분 하다 인테리어 효과 살리다 주다 같다 키우다 보다 종류 선인장 관심 생기다 결국 지름신 찾아오다 마성 지니다 있다 화분 무광 돌다 아기자기하다 반짝반짝거리다 유광 검정 포인트 연출 식탁 화분 분위기 전체 살아나다 기분 송한 희다 촉감 은근 매력 만지다 보다 하다 선인장 있다 커피 마시다 간식 먹다 카페 분위기 연출 있다 좋다 같다 덕분 기분 좋다 커피 맛나다 느끼다 지다 블로그 인스 타용 사진 찍다 다양 포스팅 등장 되다 같다 고정 버들 구미 꽃집 플라워 선인장 전문 하다 플로 리스트 아내 분과 가드너 남편 운영 계시다 플라워 플랜 하다 플라워 상품 판매 플로 리스트 양성 레슨 하다 플랜트 식물 취급 하다 스타 그램 통하다 다양 모양 종류 화분 구경 있다 운영 선인장 전문 식물 전문 스투키 인테리어 소품 꽃집 플라워 사진 동영상 선인장 식물 가드 수업 전국 배송 가능 구미 김천 대구 직접 배송 구미시 형곡동 경은 카톡 다이렉트 메세지 링크 클릭 다양 종류 선인장 구경 있다 카카오톡 아이디 연락처 통하다 상담 문의 가능 대형 사이즈 상품 전국 안전 택배 배송 가능 스타 그램 통하다 구경 식물 화분 선택 자신 맞춤 제작 라만 유니크 디자인 만나다 보다 있다 하다 구경 보다 이쁘다 많다 사다 싶다 지다 마음 커지다 큰일 이쁘다 관리 방법 설명 넣다 주다 좋다 같다 화분 정도 주다 되다 하다 같다 겨울철 주다 않다 디테일 방법 나무젓가락 찔러보다 묻다 나오다 않다 정도 마르다 주다 완료 온도 이상 떨어지다 않다 유지 평소 정도 통풍 되다 좋다 선풍기 바람 회전 틀다 주다 좋다 하다 햇빛 없다 밝다 그늘 실내 주다 필요 없다 식물 비하다 관리 한편 초보 자분 무난하다 키우다 보다 있다 같다 거기 종류 다양 취향 집안 분위기 맞다 다양 인테리어 효과 주다 있다 보다 식탁 주방 올려놓다 카페 분위기 연출 좋다 같다 요거 키우다 보다 매력 빠지다 종류 알아보다 되다 선인장 구매 싶다 찾아보다 있다 스타 통하다 구경 좋다 가깝다 방문 다양 구경 하다 레슨 학원 운영 재미나다 교육 받다 있다 같다 선인장 관심 있다 방문 보다 좋다 같다"
"Blog_지름신_201701_4087","애니메이션 보다 지름신 강림 사다 놓다 보다 있다 오랜만 읽다 재미 지네 머리 리리 카토"
