"id","parsedContent"
"Blog_지름신_201701_1","새해맞이 광화문 교보문고 신랑 다녀오다 복사 본문 기타 기능 번역 보다 새해맞이 그동안 사다 싶다 구입 신랑 광화문 교보문고 다녀오다 가다 사다 하다 권이 지름신 오다 구입 살림 보다 재테크 관심 생기다 요리 임신 출산 대하다 도요 관심 있다 분야 총집합 연애 데이트 가다 결혼 친구 약속 나가다 되다 살림 주말 집안일 결혼 오랜만 광화문 교보문고 가다 연애 기분 느낌 느낌 도서 유대인 임신 출산 비밀 전체 알다 좋다 내용 들다 있다 임신 출산 선택 되다 건강 출산 끊임없다 생명력 비결 가정 평안 기초 삼다 사다 민족 자녀 행복 도서 게으르다 요리 플로 요리 하다 보다 아쉽다 있다 사다 보다 말다 고민 요일 음식 나누다 있다 사다 보다 좋다 싶다 구입 보다 맛나다 음식 만들다 주다 하다 신랑 위하다 요리 시간 단축 있다 요리 되다 않다 싶다 보이다 주다 기대 있다 정독 맘마 미아 푼돈 목돈 재테크 실천 새해맞이 재테크 푼돈 목돈 모으다 실천 단계 나오다 있다 올해 푼돈 아끼다 목돈 모으다 보다 맘마 미아 가계부 마지막 가계부 올해 기록 오늘 가계부 기록 마지막 일정 마무리 자다 보내다 깊다 의미 있다 보내다 하다 평안"
"Blog_지름신_201701_10","새해 주말 복사 본문 기타 기능 지도 보다 번역 보다 안녕 이웃 지나다 넘어가다 나중 되다 이상 되다 수다 하다 신경 친구 아침 보내다 카톡 있다 터짐 오늘 새해 신년 특별 하다 없다 주말 일상 보내다 있다 부모 다녀오다 사랑 가족 해피 크리스마스 보내다 주다 볼일 보다 오늘 아침 예약 하다 잠원동 뿌리 염색 다녀오다 머리 다듬다 아이디 헤어 메종 반포 서울특별시 서초구 고무래 쌍동 빌딩 동관 전화 상세 보다 아이디 헤어 메종 반포 지도 보다 얼마 다니다 시작 인테리어 머리 예쁘다 하다 주다 친절 넓다 갤러리 카페 멋지다 여기 익우 실장 예약 가다 머리 말리다 손질 열정 알리다 주다 괜찮다 추천 보다 뿌다 가격 가격 저렴하다 않다 엄마 현대 카트 포인트 상품 바꾸다 가지다 카드 던지다 주다 얼마 되다 포인트 신세계 인천 가다 날씨 포근하다 걸어가다 생각 가깝다 버스 타다 가다 운동 하다 걷다 가다 걷다 가다 상품권 교환 돌아다 하다 역시 참새 방앗간 오다 아이 쇼핑 코트 득템 이월 상품 좋다 가격 네이버 컬러 가볍다 하다 들다 길이 좋다 가볍다 따다 러브 디자이너 브랜드 매장 울다 캐시미어 프로 혼방 니트 상품 사라지다 다크 그레이 편하다 따뜻하다 입다 좋다 크다 붙다 않다 적당 오늘 입다 나오다 코트 코트 입다 지하 푸드 코트 가다 백미 두유 아이스크림 먹다 신세계 인천 백미 생기다 비싸다 생가 많다 사서 나누다 먹다 좋다 맛있다 하다 먹다 많다 먹다 나다 느끼 그러다 두유 아이스크림 먹다 충전 이마트 보다 돌아오다 이마트 연말 그르다 세일 하다 파스타 소스 샐러드 드레싱 파스타 등등 사다 오다 우리 근처 이마트 있다 좋다 생각 보다 오다 넣다 만들다 대추 생강차 끓이다 이것 생각 걸리다 가다 감기 오다 직감 감기 콧물 장난 나다 같다 그렇다 산뜻하다 뿌리 염색 보다 싶다 라라 랜드 오늘 새해 첫날 그렇다 극장 사람 차다 뒷자리 남다 있다 예매 영화 뒷자리 라라 랜드 여성 취향 저격 입다 좋다 영화 보다 라라 랜드 영화 들다 영화 보다 나다 듣다 좋다 라라 랜드 감독 다미 출연 라이언 고슬링 엠마 스톤 개봉 미국 상세 보다 혼자 보다 좋다 연인 좋다 라라 랜드 새해 행복 행복 로맨스 향하다 도전 젊음 사랑 뮤지컬 노래 음악 완벽 아름답다 영상 음악 영화 보다 꿈꾸다 듯하다 느낌 영화 보다 카페 소사이어티 떠오르다 하다 보다 라라 랜드 강추 예매 마스터 땡기다 마스터 영화 시간 남다 가다 용정 유년 맞다 모티브 나오다 새롭다 음료 출시 덜다 주다 그러다 먹다 보다 오트밀 라떼 스타 벅스 오트밀 라떼 오트밀 우유 클래식 시럽 들어가다 라떼 그레인 베리 토핑 우유 마시다 두유 바꾸다 요거 오트밀 우유 베이스 말다 마시다 가다 즈음 느끼 있다 하다 식사 대용 좋다 달다 않다 카라멜 럼블 모카 들다 보다 괜찮다 같다 랜드 재미나다 보다 돌아오다 특별 평범하다 일상 누리다 있다 감사 감기 심하다 지다 않다 만들다 생강차 다량 복용 보다 해피"
"Blog_지름신_201701_100","제천 뜨다 결국 새해맞이 기념 지름 위엄"
"Blog_지름신_201701_1002","일상 일상 일산 일렉트로 마트 이마트 레이더스 일렉트로 마트 일산 복사 본문 기타 기능 지도 보다 번역 보다 통키 들어가다 시간 가다 모르다 일산 레이더스 일렉트로 마트 대하다 포스팅 하다 하다 일렉트로 마트 킨텍스 경기도 고양시 일산 서구 킨텍스 이마트 타운 지하 전화 상세 보다 일렉트로 마트 킨텍스 지도 보다 일렉트로 마트 일산 일산 이마트 타운 위치 있다 요트 레이더스 있다 주차 무료 주말 사람 붐비다 주차 힘들다 평일 다녀오다 일렉트로 마트 입구 하다 방문 드리다 이마트 레이더스 쇼핑 카트 가지다 들어가다 없다 지하 올라오다 에스컬레이터 있다 카트 보관함 카트 넣다 들어가다 되다 일렉트로 마트 방문 이마트 트레이더 스로 쇼핑 가시다 편하다 방법 방문기 아래 포스팅 참고 주다 일상 일산 레이더스 이마트 레이더스 킨텍스 다녀오다 안녕 마트 사랑 통키 이마트 트레이더 다니다 얼마 되다 평소 웅장하다 멋지다 일렉트로 보이다 지름신 지키다 주다 일렉트로 박과 보이다 하악 떼다 못하다 아이 보이다 닌텐도 보이다 통키 시작 정신 차리다 무선 지나다 두다 건담 스타워즈 유혹 아이언맨 아가 방패 도와주다 아이언맨 사다 싶다 정신 차리다 나오다 보다 간단하다 커피 간식 판매 일렉트로 보이다 주문 시간 메뉴판 아케이드 오락 있다 여기 통과 부다 정도 걸리다 하다 철없다 남편 두다 아내 각오 되다 일렉트로 마트 아웃도어 의류 컴퓨터 주변기기 프린터 있다 남자 로망 드론 드론 사다 싶다 통키 비다 지갑 보다 김치냉장고 세탁기 있다 주부 로망 다이슨 미세먼지 난리 잡다 주다 공기 청정기 한편 자리 잡다 있다 일렉트로 마트 돌다 나오다 시간 가다 사람 지름신 하다 이상 일산 일렉트로 마트 포스팅 마치다 들어가다 시간 가다 정신 차리다 들어가다 가시다 멋지다 문물 재미나다 장난감 즐겁다 시간 보내다 바라다 포스팅 순수 방문 올리다 리뷰"
"Blog_지름신_201701_1010","쇼핑 들어오다 갈아입다 바람 쐬다 하다 나가다 지름신 오다 지갑 열다 하다 커피 떨어지다 하다 분쇄 되다 커피 사고 오다 커피 내리다 바쁘다 좋다 좋다 오늘 인도네시아 만델 지원 구매 처음 사본 원두 구매 되다 동기 보다 상품 판매 금액 유니세프 세계 어린이 교육 사업 위하다 씌다 지다 얼마 어린이 교육 사업 위하다 씌다 지다 성공 커피 지름신 마치다 코너 돌다 보아주다 사다 주다 듯하다 환청 들리다 성금 성금 걸어가다 반기다 있다 녀석 이마트 출시 커피 모자라다 좋다 하다 여자 말리다 감기 오다 상큼하다 비타민 첨가 추가 다이어트 좋다 마테 구성 되다 녀석 좋다 이유 열량 이다 때문 매력 덩어리 입맛 맞다 레몬 마테 이외 페퍼민트 쟈스민 등등 홍차 종류 가지 정도 있다 기억 입안 퍼지다 알싸하다 페퍼민트 사다 하다 요즘 비타민 시급하다 이러다 상자 열다 밀봉 되다 있다 열다 보다 티백 들다 있다 가격 하다 같다 가격 정도 되다 아끼다 마시다 요즘 쇼핑 예전 없다 버릇 알다 되다 인터넷 접하다 보다 쇼핑 핸드폰 들다 검색 보다 사다 물건 대하다 보다 꼼꼼하다 자세하다 리뷰 인하다 많다 도움 되다 사소 리뷰 하다 보다 하다 티백 보이다 않다 노력 하다 대한민국 국민 모두 만족 리뷰 작성 그날 이상 이마트 쇼핑"
"Blog_지름신_201701_1013","요즘 반쪽 지름신 신나다 나이 들어가다 마음 허하다 뒤늦다 배우다 도둑 날새다 모르다 넘다 반쪽 그쪽 나다 부엌살림 죽다 싫다 하다 뜨다 서리 남아나다 없다 소소 내놓다 되다 크다 비밀 일전 블로그 들어가다 지름신 강림 지르다 대리석 도마 반쪽 전생 도마 관련 되다 하다 같다 도마 보다 심장 떨어지다 그러다 우짜다 사다 무게 만만찮다 들다 조심 발등 깨다 정도 손잡이 장식 아름답다 미치다 미치다 띄다 질르다 만드다 동안 이아이 눈길 멈추다 않다 같다 환장 예쁘다 눈길 주기 오다 느끼다 보물 창고 모시다 두다 이아이 주방 띄다 자리 주다 보다 있다 흐뭇하다 전생 요리 하다 셰프 같다 누구 반쪽 가다 하다 반쪽 감탄사 금장 환상 커플 귀요미"
"Blog_지름신_201701_1016","특별 하루 우와 결혼 되다 엄니 보다 주다 칼퇴근 성공 남편 오랜만 데이트 레스토랑 분위기 내다 평소 애기 데리다 먹다 가다 없다 좋다 하다 메뉴 소곱 저녁 먹다 하다 우리 남편 알다 건네다 있다 제안 맵다 음식 먹다 이것 먹다 엄청나다 고민 하다 애기 데리다 곱창 가다 무리 오늘 소곱 정하다 맛있다 먹다 행복 먹다 즐거움 먹다 서두르다 향하다 좋다 하다 노랑이 천국 가다 지름신 오다 되다 오늘 담다 신중 선별 머그잔 라이언 노랑 남편 하양 나누다 귀엽다 선물 대망 기다리다 기다리다 순간 시간 동안 약손 마사지 가다 퍼지르다 눕다 세다 마사지 받다 가능 하다 시간 받다 싶다 마사지 사랑 사랑 마사지 그간 쌓이다 피로 풀리다 상태 자정 되다 도착 언제 특별 있다 기념일 챙기다 간지럽다 어색하다 지다 품다 있다 생각 지금 최선 하다 마음 하다 살다 내다 주어지다 감사 주어지다 하루 하나님 말씀 살다 내다 의미 오늘 감사 마음 주어지다 하루 사랑 사람 시간 보내다 의미 있다 특별 하루 같다 내일 하루 주어지다 내일 특별 하루 되다 친하다 지내다 보다"
"Blog_지름신_201701_1017","일기 패밀리 소소 주말 일상 털기 복사 본문 기타 기능 번역 보다 안녕 지나가다 되다 주말 나가다 가다 기록 보다 일상 포스팅 반복 되다 시간 소소 일상 파헤치다 단발 머리 길다 보다 하다 정리 되다 않다 포기 크다 변화 똑같다 패턴 반복 되다 보다 자신 놓다 있다 듯하다 기분 그러다 우연찮다 작년 동생 결혼식 사진 보다 되다 단발 하다 사진 보다 뽐뿌 오다 주말 아침 하다 나다 커다 염색 고민 남편 같다 컬러 염색 않다 싶다 그레이 넘다 이쁘다 되다 미루다 오다 시작 하다 보다 남편 폐인 폐인 되다 기분 평일 소식 다이어트 시작 주말 되다 먹다 싶다 영접 참다 그렇다 꿀맛 치킨 해치우다 소식 하다 그렇다 먹다 못하다 포장 오다 아들 보다 싶다 하다 보다 오다 시식 하다 꽂히다 크다 사이즈 구매 대기 사진 찍다 개구지다 표정 운정 도시 롯데시네마 홈플러스 들어오다 크다 생기다 롯데시네마 생기다 그렇다 시설 넘다 좋다 화면 큼직하다 사운드 하다 자리 편하다 가다 되다 하다 재미 없다 이야기 듣다 고민 저희 재밌다 보다 인증 영화 나다 구경 하다 지름신 강림 패딩 항공 점퍼 트레이닝 본인 취향 맞다 초이스 하다 항공 점퍼 입다 인증 입히다 놓다 크다 보이다 듯하다 기분 대구탕 남편 먹다 싶다 하다 가다 솜씨 발휘 대구탕 가다 먹다 그렇다 꿀맛 주말 마지막 대구탕 가족 맛나다 먹다 먹다 보다 쉬다 소소 일상 즐겁다 주말 마무리 하다 바라다"
"Blog_지름신_201701_1023","드라마 쇼핑 왕루 드라마 쇼핑 왕루 마지막 커플 모으다 보다 복사 본문 기타 기능 번역 보다 오랫만 주말 쉬다 드라마 주행 하다 애청 드라마 푸르다 바다 전설 전지현 순수 지다 지순 사랑 보다 있다 이상 쇼핑 루이 서인국 남지현 커플 생각나다 찾다 보다 인생 드라마 힐링 드라마 쇼핑 마지막 명대사 줄거리 모음 커플 중점 포스터 보다 쇼핑 드라마 느끼다 지다 드라마 서인국 연기 루이 사다 재벌 도련 명품 한정판 레어 고르다 내다 구매 안목 있다 쇼핑 왕루 나오다 그렇다 지름신 부르다 소비 조장 드라마 쇼핑 루이 줄거리 명대사 사주 좋다 않다 남편 이다 외동 아들 며느리 잃다 없다 손주 잃다 않다 위하다 머나멀다 유럽 보내다 되다 드라인 대표 최일순 여사 루이 할머니 극진 정성 집사 온실 화초 과잉보호 아이콘 성장 과잉보호 자라다 보다 쇼핑 유일 친구 한정판 골라내다 안목 있다 쇼핑 루이 가치 있다 상품 나다 서인국 쇼핑 타임 할머니 좋다 않다 흉몽 꾸다 할머니 쓰러지다 루이 할머니 뵙다 위하다 한국 들어오다 되다 쇼핑 루이 비하다 전기 들어오다 않다 사다 오대산 날다람쥐 복실 천둥 번개 치다 무너지다 내리다 부모 잃다 할머니 동생 약초 캐다 살다 복실 할머니 노쇠 돌아가다 되다 서울 떠나다 혈육 동생 찾다 위하다 서울 올라오다 루이 서울 오다 경영 물려받다 되다 소식 듣다 권력 탐내다 백사장 계략 루이 드라인 지분 백사장 물려받다 되다 혼자 운전 가다 되다 와중 폭주족 만나다 신발 뺏기다 거지꼴 길거리 나앉다 되다 길거리 넘어지다 소화전 부딪히다 기억 실증 잃다 되다 누구 여기 어디 이름 서울 상경 복실 기차 소매치기 전과범 만나다 가방 뺏기다 되다 복실 강하다 생활력 구하다 찜질방 전전 생활 복실 동생 사준 국민 유니폼 똑같다 입다 있다 거지 루이 발견 복실 동생 위하다 놓아주다 이름 박히다 있다 거지 동생 만나다 확신 동생 찾다 위하다 자신 이름 기억 못하다 루이 기억 돌아오다 책임지다 보살피다 되다 남지현 의지 서인국 도망가다 보다 도망가다 보다 많다 있다 무섭다 그렇다 사람 막다 때리다 무섭다 무시 무섭다 세상 느끼다 보다 없다 느낌 루이나 복실 순수 없다 고딩 뜯기다 않다 보이스 피싱 당하다 않다 루이 기억 돌아오다 우여곡절 많다 남지현 들어오다 서인국 그러다 복실 챙기다 주다 루이 패션 손수건 플라워 브로치 만들다 복실 달다 주다 루이 복실 올드 스타일 이것 최선 남지현 보이스 피싱 당하다 서인국 복실 누구 알다 싶다 그러다 기억 돌아오다 같다 찾다 있다 같다 미안 제정신 떠오르다 가볍다 지갑 넣다 다니다 같다 느낌 그렇다 불구하다 서로 의지 착하다 복실 루이 배고프다 하다 라면 끓이다 주다 루이 기억 돌아오다 바라다 지극정성 대하다 주다 남지현 지키다 서인국 빼다 사고뭉치 서인국 바람 없다 남지현 경제 관념 쓰다 품관 쇼핑 재벌 생각 명품 쇼핑 쓸데없다 복실 카드 구매 복실 표정 복실 객식구 루이 동생 생각 주다 아끼다 주다 복실 생각 복실 가다 어디 따라가다 루이 별명 복실 생각 하다 들다 기억 돌아오다 남이 찾다 주다 있다 하다 위하다 노력 하다 시간 추억 쌓이다 서로 대하다 믿음 생기다 서인국 위로 남지현 있다 되다 복실 이상 믿다 주다 사람 복실 세상 사다 믿다 주다 사람 사람 되다 루이 퇴근 복실 기다리다 시간 길다 지다 수록 복실 그리움 질투 애착 생기다 루이 결국 서인국 남지현 커플 키스 순간 기억 잃다 버리다 사람 기억 나다 않다 기억 잃다 좋다 같다 하다 기억 잃다 나다 시간 소중하다 루이 기억 잃다 나다 이후 언제 좋다 물다 보다 복실 질문 기다리다 시간 복실 언제 기억 남다 순간 오다 복실 루이 루이 적다 놓다 기억 수첩 토대 형사 루이 추적 좋다 찾다 되다 루이 납치 당하다 드라인 본가 들어가다 되다 들이닥치다 사람 끌려가다 서인국 복실 기다리다 있다 납치 서인국 재벌 세다 갑작하다 후계자 소식 듣다 되다 복실 루이 재벌 알다 되다 놀라다 복실 서인국 빈자리 그립다 하다 남지현 루이 없다 허전하다 외로움 느끼다 복실 남지현 위하다 레드 카펫 재회 키스 복실 오빠 오다 남지현 약속 서인국 찾다 주다 루이 가족 찾다 가족 살다 여기 살다 되다 우리 가다 살다 잊다 복실 기억 돌아오다 있다 주다 약속 여기 있다 거기 있다 같다 하늘 아래 있다 있다 마찬가지 기억 돌아오다 그러다 찾다 찾다 주다 약속 않다 찾다 주다 믿다 청천벽력 같다 소식 동생 죽다 하다 사고 대신 죽다 소식 듣다 되다 김영옥 안기다 오열 남지현 우리 거두다 주다 고맙다 우리 남이 나쁘다 하다 루이 고생 하다 죄송하다 동생 죽다 죄송하다 할머니 가슴 아프다 없다 동생 죽다 죄송하다 하다 하다 자신 야속 저희 착하다 아이 혈육 잃다 슬픔 크다 슬픔 누구 알다 생각 말다 울다 이유 어쩧다 세상 그것 크다 슬픔 없다 아가씨 서운하다 생각 말다 들다 루이 만나다 아가씨 루이 크다 슬픔 있다 아가씨 루이 보다 동생 생각 눈물 나다 루이 아가씨 보다 미안 눈물 나다 보다 하다 아프다 사람 시간 보내다 만큼 서로 갉아먹다 없다 할머니 말씀 말씀 알다 동안 때문 행복 동생 죽다 모르다 행복 동생 죽다 힘들다 마음 착하다 복실 서울 떠나다 남지현 마지막 인사 결국 서울 떠나다 오대산 내려가다 복실 하다 시간 지우다 눈앞 사라지다 주다 복실 싫다 얼굴 보다 싫다 목소리 듣다 싫다 있다 싫다 복실 찾아오다 말다 복실 좋다 보다 싶다 목소리 듣다 싶다 있다 싶다 마음 상관없다 잊다 하다 시간 지우다 떠오르다 기억 오열 서인국 원래 싫다 기억 돌아오다 찾다 필요 없다 지다 진실 알다 싶다 진실 한국 들어오다 대신 죽다 사람 기억 찾다 남이 죽다 대신 남이 죽다 남지현 지키다 서인국 복실 좋아하다 자기 대신 복실 동생 대신 죽다 죄책감 다가가다 없다 지키다 보다 루이 복실 상처 주다 보다 다가가다 없다 오다 청소 주다 음식 챙기다 주다 로맨티스트 없다 오늘 복실 윤상현 남지현 아이 오열 서인국 천둥 번개 치다 부모 죽다 복실 세상 천둥 번개 무섭다 천둥 번개 치다 무섭다 자다 없다 이유 아프다 복실 걱정 복실 오다 키다리 아저씨 본부 자신 아무것 하다 주다 없다 힘들다 하다 루이 복실 심장 아프다 아프다 죽다 같다 사람 사람 인하다 가슴 아프다 있다 예감 같다 프랑스 떠나다 복실 잊다 결심 루이 루이 마지막 메시지 한국 떠나다 서인국 남지현 남기다 마지막 편지 루이 복실 추억 적다 놓다 담기다 메모 루이 진심 담기다 편지 진심 넘어가다 여자 어딨다 부산 만나다 거지꼴 하다 있다 루이 발견 남지현 재회 서인국 우리 친하다 루이 이것 프랑스 가다 여기 이러다 있다 루이 알다 당신 누구 복실 고복 진심 루이 걱정 주다 복실 이거 루이 계획 류의현 살다 있다 류의현 쫓다 서인국 프랑스 가다 복실 추억 있다 부산 내려오다 루이 발견 류의현 붙잡다 서인국 눈물 포옹 자신 뺏다 자신 피하다 도망치다 추격 복실 애타다 찾다 알리다 주다 루이 사실 사고 죽다 남자 보스 특명 남매 재회 대작전 서인국 계획 루이 계획 일사천리 이루다 지다 상봉 프로젝트 상봉 남지현 류의현 남매 계획 루이 덕분 상봉 복실 남이 찾다 덕분 사랑 복실 행복 하다 있다 되다 루이 경축 서다 류의현 프로젝트 완료 남지현 반지 끼우다 주다 서인국 마음 이렇다 있다 가짜 보이다 이거 마음 그때 주머니 있다 반지 사다 주다 싶다 마음 넉넉하다 여유 있다 내다 주다 있다 주다 상대 진심 생각 마음 비싸다 이벤트 하다 않다 소소 센스 있다 감동 고백 여자 바라다 고백 진실 고백 서인국 지키다 보다 미안 버스 타다 회사 출근 끄다 지다 지키다 보다 지키다 보다 미안 고맙다 약속 남이 찾다 주다 루이 복실 엄마 아빠 추억 찾다 주다 루이 남지현 소중 추억 되찾다 주다 서인국 복실 엄마야 아빠 엄마 닮다 보다 하다 중요 돌다 돌다 제자리 찾다 소중 인연 보물 상자 간직 고보 있다 잊다 않다 간직 주다 루이 위대 마음 길다 시간 멀다 공간 돌다 돌다 우리 만나다 하다 주다 믿다 남지현 하다 주다 싶다 믿다 아무 믿다 주다 않다 믿다 주다 믿다 하다 크다 믿다 하다 주다 사람 없다 나다 할머니 책임지다 하다 가장 하다 주다 사람 처음 위로 되다 든든하다 복실 하다 주다 믿다 고맙다 크다 프다 루이 복실 뮤직 비디오 주니엘 스페셜 커플 몰다 보다 뮤직 비디오 주니엘 악역 밉다 하다 없다 인간 캐릭터 보다 각본 음악 연기 빼놓다 없다 정도 만들다 웰메이드 드라마 보다 복선 생각 많다 쇼핑 있다 세상 사람 순수 진심 마음 무엇 바꾸다 없다 사다 없다 소중 없다 소중하다 여기다 소중하다 사람 주다 있다 가치 아다 사람 루이 복실 사람 뻔하다 부분 없다 있다 소소 감동 마음 따뜻하다 만들다 힐링 드라마 춥다 필요 따뜻하다 마음 싶다 의도 되다 연출 영화관 고보 나오다 하다 마지막 보다 강추 소소 진심 감동 담기다 드라마 나오다 좋다"
