"id","parsedContent"
"Blog_지름신_201701_3046","육아 용품 출산 용품 할인 매장 실속 만점 복사 본문 기타 기능 번역 보다 오랜만 친구 일산 점심 먹다 커피 한잔 시간 남다 아기 용품 구경 베이비 파크 다녀오다 복잡하다 힘들다 자신 없다 베페 가격 저렴하다 하다 일산 구경 가다 지름신 오다 여기 일산 베이비 파크 육아 종류 많다 알다 있다 없다 없다 겉싸개 속싸개 배냇저고리 내복 싸개 가재 손수건 이불 등등 신생아 위하다 출산 준비물 종류 다양 젖병 프다 빨대 피딩 스푼 이유 식기 아기 로션 바스 애착 인형 체온계 등등 없다 빼다 있다 베이비 파크 출산 용품 할인 매장 되다 아가 키우다 있다 친구 치발 기도 필요 같다 국민 발기 보다 딸랑이 구입 춥다 따뜻하다 아기 띠우다 필요 채우다 보다 드다 사다 친구 출산 배냇저고리 주다 전부 조카 크다 내복 입다 따뜻하다 겨울 바디 수트 이모 선물 브랜드 다양 아기 내복 있다 시간 가다 모르다 구경 출산 용품 할인 매장 한쪽 유모차 카시트 종류 많다 나름 많다 제품 알다 있다 자부 보다 모르다 제품 많다 기내 유모차 주니어 카시트 사야 고민 보다 신랑 사러가 베이비 파크 출산 용품 할인 매장 하다 아기 용품 있다 유복 임부 용품 많다 쇼핑 넓다 들다 모유 수유 친구 편하다 입다 있다 유복 입다 보다 구입 온라인 쇼핑몰 사이즈 애매하다 고민 많다 입다 보다 결정 있다 좋다 출산 빠지다 주다 임부 편하다 우리 따뜻하다 되다 예쁘다 유복 사다 오다 수다 타임 가지다 보다 약속 헤어지다 다음 만나다 우리 공주 장난감 사다 오다"
"Blog_지름신_201701_3048","다이소 식물 키우다 방울 양배추 주금 복사 본문 기타 기능 번역 보다 안녕 저번 포스팅 올리다 다이소 식물 키우다 버전 방울 양배추 주금 포스팅 다이소 성공 쇼핑 잡다 물건 지름신 키우다 기르다 곡반 정점 다이소 성공 쇼핑 잡다 물건 지름신 키우다 기르다 곡반 정점 길다 길다 제목 포스팅 곡반 정점 사온 아이 포스팅 하다 보다 양배추 사진 찍다 있다 뿌리다 주다 이상 거품 나다 오랜만 사용 그렇다 싶다 뿌리다 주다 냄새 나다 이거 그렇다 하다 물다 보다 타다 방울 양배추 주금 없다 저번 포스팅 하다 고기 친구 방울토마토 다이소 식물 키우다 버전 괜찮다 생각 상추 겨자 가느다랗다 자라다 싶다 웃자람 현상 많다 오이 보일 말랑 상추 자라다 오이 죽다 두부 털다 가다 아침 비몽사몽 찍다 해상도 되다 얼마 보다 심다 녀석 녀석 하다 올라오다 귀엽다 올라오다 먹다 이러다 하루 이틀 사이 자라다 버리다 혼자 자라다 듯하다 오이 심다 되다 뿌듯하다 자라다 있다 싫다 식물 싫다 심다 관심 갖다 되다 조금 만지다 되다 같다 벌레 생기다 그러다 건들다 하다 상추 아슬하다 기분 오이 자라다 같다 방울토마토 소식 없다 뒤집다 지다 섞이다"
"Blog_지름신_201701_3049","프라이빗 다이소 성공 쇼핑 잡다 물건 지름신 키우다 기르다 곡반 정점 복사 본문 기타 기능 지도 보다 번역 보다 다이소 성공 쇼핑 잡다 물건 지름신 키우다 기르다 곡반 정점 길다 길다 제목 포스팅 시작 보다 주차 공간 많다 좁다 느낌 들다 정도 다이소 곡반 정점 우리 다이소 다이소 이용 지점 이용 그러다 모르다 제품 있다 저렴하다 하다 사다 보다 부담 오늘 성공 쇼핑 같다 텃밭 꾸미다 상추 오이 친구 구입 빼다 방석 시다 방울 양배추 오이 방울토마토 상추 겨자 새롭다 친구 부탁 사용 방법 꼼꼼하다 케이스 단단하다 아쉽다 오이 방울토마토 친구 적다 해당 링크 아래 잡다 물건 느끼다 하다 방울 양배추 방울 양배추 주금 안녕 저번 포스팅 올리다 다이소 식물 키우다 버전 방울 양배추 주금 마음 들다 방석 고민 고민 갈색 고르다 마음 들다 하다 성공 쇼핑 저번 구입 어둡다 계열 하다 종류 모으다 잡다 물건 생각 하다 자수 하다 보다 생각 배우다 않다 모으다 있다 다이소 곡반 정점 경기도 수원시 권선구 곡선 전화 상세 보다 다이소 곡반 정점 지도 보다 다이소 곡반 정점 친절 같다 개인 생각 그러다 방울 양배추 이야기 다음 하다 보다"
"Blog_지름신_201701_3055","캠핑 여행 다용도 미니 좋다 커피 지름신 복사 본문 기타 기능 번역 보다 동계 캠핑 없다 되다 겨울철 따뜻하다 하다 주다 화로 불다 때리다 보다 비싸다 구입 장작 사라지다 캠핑 기본 아이템 용도 인지 모르다 검색 걸리다 구입 단단하다 그릴 오다 다리 부분 약하다 무겁다 들어가다 없다 패스 화로 깊다 지르다 보다 싶다 가볍다 좋다 접다 부분 부실 그러다 개다 지르다 고기 굽다 소주 한잔 먹다 당장 사용 하다 보다 위하다 준비 준비물 없다 어디 준비물 얻다 오다 없다 원두 오다 시작 있다 커밍"
"Blog_지름신_201701_3061","바쁘다 지나가다 있다 바쁘다 신년 시작 하다 바쁘다 스트레스 받다 지름신 발동 구하다 있다 다이나 등장 주다 런던 베스트 뜨다 자연 나머지 아이템 테일러 재반 나머지 선호 않다 구하다 싶다 가다 성비 택하다 신품 장점 있다 오늘 꽂히다 있다 바니 카르멘 익숙하다 카르멘 멜로디 특유 깔끔하다 연주 좋다"
"Blog_지름신_201701_3070","진구 전자 담배 부산 서면 전자 담배 하카 다가오다 실감 하다 오다 하다 택배 오다 부전 시장 보다 많다 느끼다 실감 서다 하카 오늘 포장 보내다 정신 없다 바쁘다 좋다 하다 부산 서면 전자 담배 하카 매장 디아 커피숍 있다 공사 하다 무엇 입점 진구 전자 담배 서다 하카 새롭다 이웃 교촌 치킨 입점 알다 있다 괴롭다 여러분 저렴하다 가격 보상 지름신 괴롭다 괴롭다 하다 마시다 절호 찬스 잡다 도움 필요 연중무휴 진구 전자 담배 서다 하카 방문 주다 서면 출국 즐겁다 금요일 보내다 행복 주말 맞이하다"
"Blog_지름신_201701_3075","가든 비우다 쉽다 샘플 비우다 복사 본문 기타 기능 번역 보다 내리다 덕분 예쁘다 출근길 아침 시원하다 하다 엉덩방아 찍다 회사 있다 사이 계시다 주민 내부 쌓이다 치우다 주다 친환경 설제 구입 뿌리다 두다 소식 감사 죄송하다 느끼다 따뜻하다 이웃 자랑 싶다 우리 동네 최근 비우다 내다 샘플 샘플 많다 이것 쓰다 하다 줄어들다 샘플 비우다 내다 쉽다 물건 뒤늦다 깨닫다 상큼하다 레몬 비다 리프 바디 봄바 샘플 샘플 비우다 내다 본품 사다 하다 생각 찬장 제품 있다 준비 철저 지름신 절친 작다 튜브 들다 있다 샘플 리릭 그동안 수납장 굴러다니다 있다 작다 녀석 비우다 주다 시원하다 샘플 사용 주다 본품 비우다 내다 내부 남다 있다 잔여물 깨끗하다 닦다 활용 되다 있다 하다 지저분하다 버리다 지다 활용 어렵다 하다 녀석 쓰다 핸드크림 샘플 없다 차다 있다 샘플 정도 지나다 한산하다 지다 상태 스킨 얼마 없다 에센스 많다 샘플 줄어들다 시원 기분 샘플 신경 쓰다 주다 줄어들다 비우다 쉽다 물건 같다 버리다 재미 쏠쏠하다 가볍다 시도 보다 좋다 같다 이번 주말 단순 즐거움 배우다 기법 드레스 적용 보다 드레스 비우다 내다 작업 귀찮다 미루다 있다 귀찮다 미루다 두다 보다 시간 가지다 보다 저녁 도깨비 보다 도깨비 나다 살다"
"Blog_지름신_201701_3082","가지다 싶다 복사 본문 기타 기능 번역 보다 가지다 싶다 만성 반석 가지다 싶다 들어가다 오랜만 겨울 내리다 새벽녘 멋지다 설경 베란다 서다 감상 하다 있다 행복 하다 눈밭 걷다 있다 서운하다 하다 조용하다 새벽 보다 있다 사진 촬영 담다 오후 되다 녹다 있다 빗소리 착각 들다 정도 얼큰하다 먹다 싶다 생각 불금 무엇 챙기다 먹다 하다 보다 치맥 진리 엊저녁 맥주 하다 아내 핀잔 걱정 블로그 질문 만성 반석 블로그 질문 하다 가지다 싶다 무엇 정하다 지다 있다 이거 오두막 사용 있다 구매 이전 사용 하다 장비 처분 구매 하다 남다르다 애정 있다 아내 냉장고 받다 주다 구입 하다 하다 카메라 기변 하다 하다 되다 않다 싶다 가지다 싶다 하다 있다 블로그 답변 나름 충실 블로그 친하다 지다 싶다 마음 하다 마음 여유 닿다 않다 요즘 하루 고민 하다 정도 내려놓다 올해 크다 미련 없다 외부 요인 때문 싶다 동안 하다 오다 선택 집중 옳다 결정 의문 들다 정도 만성 반석 블로그 답변 하다 있다 가지다 싶다 하다 있다 오두막 기변 하다 싶다 마음 만성 반석 환전 하다 알제리 연수생 떠나다 여기저기 환율 비교 보다 환전 하다 트럼프 대통령 취임 환율 변동 되다 오르다 내리다 알다 없다 환전 하다 사진 촬영 하다 가지다 싶다 있다 하다 불리우다 있다 만성 반석 지름신 강림 지금 손꼽다 기다리다 있다 하다 올해 자가용 교체 하다 하다 견적 뽑다 하다 싶다 있다 비용 부담 최적 시키다 보다 블로그 질문 가지다 싶다 물다 만성 반석 답변 하다 이라다 작년 고민 하다 있다 카메라 추가 구입 하다 하다 비용 이르다 그렇다 장비 구입 주변 지인 선택 집중 오두막 정식 명칭 현재 오두막 사용 있다 주변 지인 기변 하다 있다 지름신 강림 눈독 들이다 있다 아내 결단 내리다 모르다 달러화 가지다 싶다 위하다 필요 환전 하다 오다 사진 담다 달러 다르다 해외여행 환전 않다 알제리 가다 환전 하다 고액 하다 하다 하다 달러 사진 촬영 갖다 싶다 이유 가지다 싶다 있다 넉넉하다 순위 갖다 싶다 욕심 하다 그렇다 경제 능력 없다 있다 하다 생활 우선 윤택 선택 싶다 블로그 질문 작성 있다 손목 어깨 통증 고생 지나다 겨울 되풀이 되다 있다 쉬다 싶다 마음 수행 비서 두다 편하다 가지다 싶다 답변 하다 캐다 놓다 만성 반석 가지다 싶다 지름신 강림 기다리다 있다 달러화 만성 반석 환전 하다 환율 고려 오늘 최적 하다 환율 시장 되다 몰다 트럼프 대통령 취임 확실하다 가지다 싶다 구매 있다 유년 새해 시작 지나다 오늘 대한 많다 내리다 멋지다 설경 사진 담다 싶다 블로그 질문 포스트 작성 가지다 싶다 무엇 머리 굴리다 보다 정하다 지다 있다 놀라다 지름신 강림 기대 보다 창밖 햇살 따사하다 내리다 녹다 빗물 흐르다 있다 대한 추위 어디 있다 그러다 만성 반석 가지다 싶다 꼽다 지름신 강림 고대 블로그 답변 하다 적잖다 고민 하다 있다 하다 달러화 환전 하다 오다 가지다 싶다 득템 이유 사진 촬영 하다 캐다 가지다 싶다 만성 반석 가지다 싶다 한데 조금 기다리다 있다 오두막 사용 하다 만족 하다 있다 근래 필요 장비 구입 조명 제품 하다 만족 시키다 주다 못하다 서운 마음 크다 후일 멋지다 스튜디오 갖다 싶다 마음 있다 블로그 질문 지르다 보다 이야기 하다 내다 마음 헤아리다 딴지 걸다 현재 만족 하다 블로그 질문 대하다 답변 불금 오후 만성 반석 블로그 질문 대하다 답변 포스트 작성 손목 힘겹다 하다 욕조 오다 받다 놓다 휴식 취하다 하다 하다 있다 좋다 힐링 시간 며칠 부항 요법 하다 피멍 들다 자국 보다 마음 아프다 자신 사랑 마음 가지다 싶다 대수 건강 챙기다 좋다 싶다 결론 선택 집중 작심삼일 되다 않다 하다 보다 네이버 블로그 최적 쉽다 않다 만성 반석 얽매이다 알다 있다 초기 초심 마음 되돌아가다 하다 쉽다 않다 장난 시험 하다 말다 결론 최적 멀다 그러다 파이팅"
"Blog_지름신_201701_3083","파랗다 사자 세트 구입 오늘 도착 박스 꽃밭 도배 있다 박스 놀람 여기 후기 생각 없다 박스 개봉 깜놀 깜놀 마음 진정 없다 비다 공간 채우다 이것 허다 펴다 보다 싶다 밀다 펴다 보다 하다 펴다 지다 찢어지다 난리 신문지 구기다 넣다 되다 채우다 넣다 공포 경악 놀라다 가슴 진정 되다 신문지 곱다 싸이다 오다 있다 천장 지도 봉투 만들다 하다 하다 그렇다 봉투 만들다 쓰다 없다 지름신 좋다 오늘 붕어빵 봉투 접다 하다 파랗다 사자 받다 동생 비밀 댓글 달다 주다 돈지랄 방학 나다 돌아오다 붕어빵 봉투 제작"
"Blog_지름신_201701_3091","부처 느티나무 무성 떨어지다 죽음 나다 이야기 우리 죽음 있다 나뭇잎 죽음 나뭇잎 연연 말다 하다 자신 축소 모자라다 사람 되다 되다 모자라다 부족 채우다 발악 하다 우리 인생 하루 수없다 죽음 반복 살다 하다 살다 죽다 싶다 살아나다 신비 연속 그러다 매사 일희일비 하다 목숨 걸다 연연 없다 감사 희망 안다 이다 가다 우리 인생 최선 선택 우리 보이다 일직선 연결 새벽 정권 오다 실버 서퍼 위협 보다 읽다 자다 반복 하루 덥다 없다 그러다 정신 건강 좋다 같다 저녁 서현역 나가다 거리 헤매다 교보문고 들르다 서점 들르다 지름신 기다 벌다 주제 책값 쓰다 인생 변환 되다 있다 유일 신념 때문 지름신 않다 위궤양 때문 쓰리다 가다 하다 그러다 서현역 젊음 거리 나오다 미니스커트 젊음 만끽 있다 들다 가다 있다 막걸리 파다 포차 들르다 혼자 막걸리 한잔 하다 지키다 있다 집사람 부르다 사다 이야기 하다 망가지다 주말 즐기다 보다 막걸리 마시다 보다 휴가 즐기다 사람 부럽다 지다 올해 하다 접다 지나가다 하다 많다 행복 누리다 오다 감사 잊다 인생 균형 유지 하다 보다 한나라당 경선 정치판 관심 가지다 모처 부르다 내다 집사람 무시 빠지다 버리다 원죄 짓다 하다 하다 집사람 대하다 원죄"
"Blog_지름신_201701_3093","가전 인테리어 다이소 전구 소품 전구 인테리어 전구 이쁘다 복사 본문 기타 기능 번역 보다 전구 이소 전구 소품 좋다 기분 우울 있다 그렇다 무엇 지르다 하다 압박감 있다 쇼핑 지름신 나중 후회 다이소 가다 어치 정도 지르다 풀리다 있다 시간 지나가다 다이소 있다 들르다 구경 하다 사놓다 다이소 전구 소품 사용 하다 식물 담다 기르다 하다 다양 활용 매달 없다 기분 울적 여기저기 향초 켜다 두다 하다 전구 사다 넣다 두다 다이소 파다 트리 전구 까맣다 투명 구매 하다 백색 컬러 길이 구매 전구 크기 크다 작다 좋다 가격 보다 이쁘다 묵직하다 무게 있다 건전지 들어가다 버튼 있다 있다 버튼 있다 깜빡이다 산발 깜빡이다 이쁘다 끄다 지다 켜다 안타깝다 투명 이쁘다 크리스마스 하다 하다 만족 하다 있다 백색 백색 나름 이쁘다 차갑다 보이다 얼음 연상 눈꽃 하다 집안 인테리어 크다 하다 귀찮다 작다 소품 만족 즐겁다 하다"
"Blog_지름신_201701_3097","요즘 계란 황금 나다 모르다 생각 계란 사다 아침 먹다 비싸다 먹다 친구 향초 켜다 놓다 즐겁다 진영 지름신 들리다 미치다 듯이 사고 좋다 하다 담다 카드 울다 그러다 월요일 행복 패딩 사다 싶다 인터넷 주문 늦다 오다 취소 포기 있다 찰나 괜찮다 가격대 따스다 패딩 발견 가다 날씨 춥다 마음 따뜻하다 본격 엄마 보다 싶다 지다 사랑 이성 사랑 가족 친구 주변 사람 애정 섞이다 사랑 내용 이야기 풀다 가다 같다 카페 치킨 놓다 기다리다 쿠폰 있다 현금 원내 먹다 치킨 맛있다 다리 날개 있다 확인 따끈하다 상책 모두 연애 민조 재밌다 그림 요즘 하다 가볍다 느낌 있다 그림 이루어지다 있다 대부분 공백 많다 읽다 시간 걸리다 정도 그러다 내용 자체 현실 재미있다 심심하다 연애 힘들다 위로 보다 좋다 재미 대하다 내용 나중 포스팅 하다 계획 주기 상황 풀이 전개 방식 년차 연애 당연지사 년차 주기 공감 그렇다 불구하다 없다 되다 허전 존재 되다 버리다 생각 보다 무섭다 두렵다 존재 되다 버리다 행복 하다 주다 근원 사랑 있다 담날 내사 새우 요리 새우 크림 파스타 볶음밥 코카 콜라 근처 마트 칵테일 새우 팔다 잽싸다 집다 요리 인분 먹다 무리 칵테일 새우다 비린내 나다 없애다 위하다 식초 미림 같다 이용 없애다 제격 좋다 하다 영화 이터널 선샤인 거짓말 치다 영화 넘다 보다 보다 잊다 보다 되다 마약 같다 영화 영화 포스팅 하다 예정 어제 가족 선물 회사 식구 사다 백화점 저녁 좋다 하다 나베 볶음밥 쌀국수 먹다 생각 나다 욕심 어제 김태희 결혼식 어리다 좋다 하다 가수 김태희 어리다 부럽다 부럽다 하다 배우 어울리다 연예인 화려하다 결혼식 하다 않다 소신 소소하다 지인 하다 멋지다 보이다 드레스 하다 고가 드레스 김태희 원단 결정 디자인 참여 정도 섬세하다 준비 하다 바라다 부럽다 결혼식 하다 같다 이쁘다 보이다 부탁 우리 사랑 여행 땡기다 서다 사다 급하다 이번 주도 알차다 보내다 담주 알차다 보내다"
"Blog_지름신_201701_3108","오클라호마 어학 연수 남다 생산 하루 보내다 어학원 오늘 공부 우리 나라 여기 하다 외우다 하다 않다 같다 오늘 진도 나가다 특정 동사 전치사 붙다 하다 붙다 되다 대하다 있다 들다 다음 가다 오다 되다 우리나라 시험 나오다 밤새다 외우다 이다 수긍 여기 외우다 말다 외우다 새다 하다 하다 친구 공감 누구 울다 하다 믿다 그대 있다 가다 가다 하다 같다 있다 음악 좋다 하다 중국 친구 하다 중국 노래 추천 달다 하다 그러다 동안 노래 적다 주다 있다 하나 들다 보다 한국 노래 같다 캡쳐 첨부 심심하다 들다 보다 하다 참고 뛰다 쓰다 오늘 액티비티 식목 생각 되다 날씨 바람 불다 바람 불다 따다 듯하다 날씨 때문 맑다 깨끗하다 하늘 최고 그래픽 합성 놓다 듯하다 하늘 최고 주차 하다 끊다 하다 모양 여기 공사장 누구 짓다 주다 사람 유리창 비치다 하늘 이쁘다 들어가다 기프트 있다 친구 지름신 강림 막다 주다 분위기 밝다 아기자기하다 배치 있다 안내 받다 들어가다 안내 하다 주다 근무 은퇴 여기 봉사 있다 열다 정글 같다 내부 보이다 인상깊다 식물 이것 없다 뿌리 뻗다 물다 수증기 흡수 하다 동일 식물 사진 밝기 조절 호러 영화 나오다 카멜레온 오묘 민트 식물원 내부 채광 좋다 되다 있다 크다 식물 때문 카메라 맞추다 힘들다 같다 정리 되다 정원 보다 나가다 겨울 죽다 하늘 보다 걸음 걸어가다 보이다 멋지다 빌딩 찍다 타워 팰리스 분양 쓰이다 지다 있다 같다 그러다 멋지다 걷다 보다 가족 산책 나오다 사람 있다 강아지 데리다 나오다 사람 있다 발견 우리 나라 있다 구경 나다 시간 남다 유명 아이스크림 가게 저번 가다 브람스 가다 이번 와플 아이스크림 버블 풍선 풍선 알다 알다 보다 풍선 있다 교정 풍선 씹다 피하다 먹다 일정 끝내다 눕다 들다 버리다 먹다 소리 일어나다 세끼 챙기다 먹다 있다 덕분 어마어마하다 닭고기 으깨다 감자 먹다 화장품 가게 가다 하다 다녀오다 마트 가다 위하다 타다 나오다 하늘 이쁘다 여기 하다 지다 시간 비슷하다 밤하늘 하다 차다 있다 북극성 추정 전구 같다 나중 기회 되다 카메라 노출 밤하늘 찍다 보다 처음 사진 찍다 싶다 생각 들다 예전 심화 과학 과학 캠프 보다 하다 높다 고지 가다 하다 춥다 수록 보이다 하다 떨다 보다 이러다 여기 날씨 선선 트이다 평지 하늘 넓다 없다 별도 보이다 세다 많다 오늘 구름 끼다 보이다 하다 시골 들어가다 은하수 보이다 초등 학교 과학 캠프 가다 높다 춥다 날씨 보다 많다 여기 하늘 멋지다 같다 미국 태어나다 항공 천체 관련 직업 가지다 싶다 하다 않다 화장품 가게 다녀오다 하루 내일 지지 난주 가다 메이다 이벤트 임장 비스 무리 가다 하다 들다 내다 유흥 즐기다 틀다 내일 기대 마치다 시각 오후"
"Blog_지름신_201701_3122","재희 성장 일기 아기 헤어밴드 옥모 헤어밴드 착용 복사 본문 기타 기능 번역 보다 성장 일기 동생 들다 여자 아이 액세서리 생명 헤어밴드 모으다 시작 남자 아이 키우다 입장 헤어밴드 이쁘다 하다 들여가다 구입 마음 없다 동생 헤어밴드 하사 우리 옥모 찌다 하얀색 리본 밴드 우리 리본 밴드 처음 기대 하다 씌우다 보다 이거 이거 이쁘다 이러다 헤어밴드 모으다 기세 걱정 되다 이러다 도치 저렇다 웃다 천사 없다 와중 우리 옥모 이야기 있다 사람 비슷하다 사진 보이다 엄마 보다 사진 공감 비슷하다 사진 보이다 추리다 추리다 사진 우리 인테리어 소품 이용 찍다 설정 이름 하다 아빠 목마 태우다 주다 하다 아들 바보 되다 신랑 사람 애완 동물 생김새 자기 비슷하다 생기다 끌리다 하다 닮다 이쁘다 아가 데리다 놓다 신랑 아들 찾아보다 하다 짚다 찾다 있다 만큼 닮다 유전자 크다 가다 얼굴 바뀌다 하다 결국 종착역 신랑 되다 같다 느낌 헤어밴드 위력 알다 지름신 소환 가다 보다"
"Blog_지름신_201701_3124","밤새 소복 내리다 모두 잠들다 새벽 내려오다 보다 오다 세상 하얗다 퇴근 무렵 택배 오다 오다 뜯어보다 영양제 생소 이름 우먼 기어 설치다 위하다 영양제 살다 같다 자다 게임 티브이 보다 구박 하다 그러다 마음 걸리다 보다 어디 소문 들다 듣다 영양제 검색 하다 보다 가격 나가다 쇼핑 지름신 저렴하다 구입 믿다 우먼 기어 사람 먹다 좋다 검색 보다 면역력 떨어지다 여성 혈액 순환 되다 여성 피부 보습 필요 여성 운동 다이어트 시작 여성 쉽다 피로 지다 여성 건강 필요 여성 여성 필요 영양제 갱년기 여성 좋다 영양제 하다 포장지 뜯어보다 우먼 기어 있다 홍삼 비타민 엽산 아연 우먼 기어 대두 이소 플라본 미네랄 우먼 기어 히알루론산 비타민 셀렌 복용 우먼 기어 아침 우먼 기어 점심 우먼 기어 저녁 섭취 반응 따르다 캡슐 섭취 되다 자세 설명 우먼 기어 홈페이지 참고 단계 솔루션 혈행 개선 면역력 증진 건강 피부 보습 귀하다 선물 아끼다 구정 지나다 먹다 하다 오다 좋다 사다 주다 오늘 먹다 아침 우먼 기어 먹다 나오다 입안 침샘 자극 되다 지침 고이다 입안 상쾌하다 느낌 반응 오다 사랑 정성 전달 기분 같다 먹다 효과 있다 후기 날리다 드리다 먹다 먹다 잘다"
"Blog_지름신_201701_3127","하빌 델다 오다 하다 지다 있다 크다 아들 초등 입학 하다 이것저것 준비 많다 취미 생활 뒷전 밀려나다 탈출 초등 새롭다 꾸미다 주다 하다 책상 들이다 하다 지출 많다 반타 하빌 지름신 접다 두다"
