"id","parsedContent"
"Blog_지름신_201701_2052","뽑다 주다 안녕 작품 만들다 문방구 있다 조그맣다 뽑다 기계 겁나다 동전 넣다 돌리다 하다 아이디어 떠오르다 쓰다 예쁘다 보아주다 미방 짜다 체리 진아 미안 석하다 요정 나라 신데렐라 나오다 요정 할머니 잠자다 공주 요정 엄지 공주 등등 다양 요정 회의 열다 회의 주제 인간 인간 요정 관계 생각 의외 많다 인간 요정 만들다 있다 소녀 첫사랑 아이 좋아하다 마음 사랑 순수 요정 강력하다 만들다 주다 있다 아기 태어나다 요장 태어나다 태어나다 아기 요정 서로 도와주다 요정 직접 도와주다 인간 그거 모르다 요정 다양하다 이제 요정 인간 이어지다 없다 상상력 사라지다 때문 이제 요정 인간 만들다 하다 조그맣다 소리 사람 핸드폰 꺼내다 대한민국 세계 주목 최고 인기 누리다 있다 아미 대왕 후드 라이언 지방 가족 제이크 어렵다 포켓몬스터 시리즈 영국 중국 일본 미국 세계 누비다 성공률 자랑 대한민국 최고 아미 아미 군대 이름 군대 정하다 모르다 그녀 예쁘다 얼굴 보다 달려들다 고추 장남 정신 차리다 군대 가다 당당 담다 있다 최근 발표 예쁘다 얼굴 뽑다 하다 모습 안티 그녀 얼굴 보다 남자 꼬이다 그녀 뽑다 실력 기네스북 등재 세계 최초 지름 일반 뽑다 기계 잡다 엄청나다 신화 만들다 내다 대단 이다 장면 찍다 방송사 시청 전국 기준 시청 정점 찍다 그녀 인기 지금 치솟다 있다 그녀 그녀 친구 아미 크루 최고 튜버 받다 멤버 다이아 플레이 버튼 소유 아미 크루 멤버 골든 워치 한일전 우승 미스테리 추리 방송 뽑다 수표 뽑다 미스코리아 드리다 어린이 액체 괴물 채널 수상 카드 마술 저작 사상 최다 기록 아미 수상 경력 엄청나다 스펙 하루 천만 벌다 놀랍다 신화 가지다 여자 조합 사람 생활 활력소 웃음 안기다 주다 회사 치이다 살다 자식 주말 어색하다 아버지 아이 아미 크루 이야기 하다 웃음꽃 피우다 기적 보다 있다 외모 완벽 미스코리아 상징 크리스탈 크라운 소유 있다 귀엽다 티어 성숙 원투 쓰리다 청순하다 시크 도도하다 드림 몽환 카드 상큼하다 아련하다 모이다 비글 비글 보다 사람 웃음 끊이다 않다 만들다 레전드 잠복 기간 걸치다 예고 생방 켜다 히트 연예 기자 방시혁 동네 나오다 여자 아침 그렇다 안개 끼다 있다 묘하다 분위기 마시다 찌뿌등하다 방송 키다 쏟아지다 나오다 댓글 미안 시청자 오랜만 오다 어정쩡하다 스트레칭 자세 표정 못나다 댓글 오리 언니 아미 언니 레이 오랜만 언니 한우 좋다 아미 끄다 하다 강남 부자 풍선 개다 쏘다 오리엔테이션 누나 얼굴 언니 카드 누나 끄다 하다 누나 알다 아미 언니 사랑 사랑 아미 언니 사랑 사랑 우리 만나다 언니 사랑 카드 누나 끄다 하다 그리다 라이트 꼬다 울다 군대 오다 댓글 줄이다 아침 상쾌하다 풀다 이슬 겁나다 먹이다 서죽 뻔하다 약하다 가지다 망하다 정신 차리다 맞다 아이 유거 편하다 우야 표정 짓다 무섭다 진지하다 물다 보다 한마디 시청자 아미 크루 기울이다 우리 동네 문방구 없다 아미 카드 유레카 티어 원투 드리다 고개 돌리다 바라보다 아미 보이다 조그맣다 뽑다 기계 달려가다 있다 크루 문방구 달려가다 문방구 조그맣다 미니 있다 그곳 들어가다 신데렐라 나오다 요정 할머니 비슷하다 외모 똑같다 원투 쓰리 할머니 바라보다 크루가 정신 차리다 물건 바라보다 미니 하다 조그맣다 조그맣다 조그맣다 정수기 예쁘다 귀엽다 아미 크루 지갑 들썩거리다 조그맣다 세트 보다 지름신 강림 세트 구성 하늘색 벽지 나무 바닥 조그맣다 풍경화 심플 정수기 냉장고 하늘색 구름 소파 파랗다 라운드 카펫 하늘색 창문 미니 티비 하늘색 식기 도구 도마 등등 하늘색 파랑 하얀색 귀엽다 되다 있다 같다 작다 다락방 사다 버리다 하다 시청자 놀라다 누구 보다 같다 작동 서비스 하얗다 나무 달다 주다 화장실 안방 작은방 큰방 달다 주다 서비스 카드 예쁘다 연두 초록 하얗다 세트 사다 자신 존경 셜록 본따다 사다 가격 레드 화이트 카드 블랙 화이트 통나무집 원목 드리다 이름 어디 반짝이다 화사 눈물 비싸다 보이다 사다 바르다 바르다 우리 쓰다 기분 좋다 지다 할머니 동전 바꾸다 쥐다 주다 뽑다 하다 주다 아미 크루 뽑다 기계 몰려들다 뽑다 돌리다 뽑다 이름 요정 기르다 주다 유치하다 아미 신나다 뽑다 기계 손잡이 넣다 돌리다 나오다 요정 인형 검정 정장 세트 이대로 아미 무너지다 아미 계속 돌리다 돌리다 보다 반짝거리다 투명 케이스 담기다 있다 세상 가지다 행복 되다 찌다 솔트 카드 원투 드리다 유레카 그렇다 돌리다 나오다 이번 뽑다 기계 난이도 지옥 크루 시간 지나다 방송 끄다 아미 크루 사다 저택 돌아가다 힘들다 하루 이거 쓰다 죽다 슬럼프 오다 같다"
"Blog_지름신_201701_2056","건강 위하다 선택 이롬 황성주 국산 두유 검은콩 복사 본문 기타 기능 번역 보다 춥다 배고픔 찾아오다 춥다 떨다 고프다 며칠 쇼핑 구매 두다 황성주 국산 두유 검은콩 마시다 주다 이롬 황성주 국산 식품 장관 수상 유업 최초 하다 주다 이롬 자부심 강하다 검은콩 칼슘 두유 박스 호두 아몬드 두유 박스 검은콩 두유 박스 주문 황성주 두유 국산 만들다 좋다 지인 황성주 두유 마시다 쇼핑 저렴하다 판매 지름신 강림 부실 좋다 챙기다 먹다 되다 먹다 않다 우유 마시다 소화 시키다 마시다 단백질 먹다 같다 하다 심하다 철분 부족 챙기다 먹다 하다 요즘 입맛 없다 우리 자라다 가지 곡물 국산 사용 재료 좋다 같다 황성주 박사 개발 총체 건강 솔루션 연구 믿다 있다 식품 믿다 마시다 보다 건강 위하다 우유 대신 두유 마시다"
"Blog_지름신_201701_2062","고군분투 초보 엄마 아빠 육아 일기 아기 발달 이해 시작 복사 본문 기타 기능 번역 보다 요즘 말귀 알아듣다 신기하다 모르다 하다 들다 나현 최근 보이다 주다 발달 입히다 혼자 넣다 양손 쓰다 물컵 잡다 먹다 흘리다 손잡이 없다 가능 딸기 포도 퍼즐 두다 각각 사물 이름 주다 딸기 주세요 하다 딸기 주다 주방 놀이 소품 가지다 먹다 하다 엄마 먹이다 주다 하다 떨어지다 사물 가르키다 가져오다 하다 가져오다 부바 알아듣다 매달리다 문고리 잡다 까치발 들다 시도 되다 양팔 벌리다 엄마 도움 요청 신기하다 알리다 주다 않다 하다 대견하다 하다 엄마 천재 보이다 하다 울딸 천재 똑똑하다 달다 살다 얼마 아이 카페 가다 놀이 혼자 터득 모습 감탄 전바 잡다 혼자 트램 폴린 타다 이거 아기 하다 있다 신기 신기 그날 나현 사랑 모습 지름신 오다 가격 가량 정신 차리다 이외 기술 보이다 주다 있다 뒤집기 베베 시절 보이다 주다 많다 기록 않다 무엇 하다 내다 기억 힘들다 성장 같다 이제 기록 보다 나현 지금 하다 내다 잡다 걸다 동안 서다 있다 장난감 잡다 있다 엄마 발견 빠르다 걸다 안기다 무릎 구부리다 펴다 하다 있다 숟가락 이용해 이유식 먹다 혼자 보다 놀다 계단 기어오르다 내려오다 엄마 따르다 하다 물티슈 닦다 돌이 방바닥 문지르다 등등 아기 어떻다 궁금하다 하루 다르다 성장 딸아 크다 주다"
"Blog_지름신_201701_2063","오랜만 일상 포스팅 하다 육아 하다 일상 사라지다 같다 세계 힘들다 좋다 졸리다 행복 이상 세계 일상 포스팅 이렇다 저번 주말 이번 주말 백화점 시어머님 생신 친구 결혼식 뜻깊다 기쁘다 쓰다 백화점 가다 지름신 나타나다 주말 시어머님 생신 식사 마치다 신세계 본점 가다 아기 있다 유모차 타다 보다 이용 되다 엘레 이터 지나가다 타다 본점 아기 용품 파다 베이비 라운지 처음 들어가다 보다 오다 들어가다 보다 이날 기저귀 갈다 하다 들어가다 보다 좋다 기저귀 가다 눕히다 천장 보다 웃다 있다 보다 모빌 있다 세면대 휴지 쓰레기통 구비 좋다 오랜만 올해 붉다 닭띠 나오다 텀블러 예전 사다 이제 사다 되다 좋다 텀블러 분유 타다 보온병 가다 있다 그렇다 보다 이번 주말 오늘 친하다 친구 결혼 있다 다녀오다 서초동 바인 웨딩 이쁘다 동생 친구 유부녀 되다 식사 나오다 갈비탕 맛있다 음식 맛있다 남편 결혼식장 가다 강남 신세계 가다 네스프레소 부티크 있다 캡슐 구매 가다 보다 우리 사진 이것 기념 찍다 가다 이것저것 신고 입다 구경 하다 캡슐 사다 연하다 스타일 좋다 하다 이번 바디 있다 사다 보다 쓰다 마시다 보다 진하다 라떼 만들다 되다 여기저기 신발 구경 득템 이쁘다 나이키 운동 코르테즈 코르테즈 넘다 이쁘다 오다 청바지 입다 신다 싶다 이쁘다 않다 중학교 고등 학교 코르테즈 살다 명동 압구정동 돌아다니다 생각나다 로고 자수 되다 있다 예약 가다 다행 사이즈 있다 구매 오다 우리 아기 앨범 찾아오다 찾다 앨범 출생 사진 사진 있다 앨범 미래 희망 산부인과 산후조리원 이용 무료 조리 가격 포함 만들다 주다 사진 패스 사진 찍다 하다 결정 싶다 맡기다 놓다 다니다 편하다 편하다 그러다 시간 있다 좋다 보내다"
"Blog_지름신_201701_2068","플리트 가이드북 이큐 카라스 코마 오늘 이래 하다 보다 감격 오늘 시티 가다 보다 건물 대단하다 이사 가다 싶다 마음 드다 없다 오늘 위하다 가다 송도 투어 가깝다 않다 싶다 코스트코 가다 회원 등록 하다 핫도그 세트 지르다 지름신 다음 송도 현대 프리미엄 아울렛 가다 교보문고 달리다 교보문고 있다 핫트랙스 봉이 앨범 구경 카다 고리 맞다 않다 조그맣다 파다 허튼짓 있다 코믹 코너 달려가다 쌓이다 있다 보다 이큐 쌓이다 있다 인증 없다 죄송하다 나오다 캘린더 붙다 있다 만화책 처음 영접 보다 흔하다 설명 없다 후기 이큐 하다 만화책 나중 모으다 멀다 일괄 사다 하다 플리트 가이드북 사다 신나다 잡다 찍다 사진 계산 찍다 사진 보다 허세 교보문고 드림 사용 계산 모서리 찢다 드림 찍다 주다 돌아다니다 우리 아가 데리다 있다 모서리 다치다 않다 걱정 보다 흔하다 쇼핑 질목 타다 저적 가르다 지다 같다 사이 백도 사이다 사다 마다 일본제 그렇다 탄산 세더 맛있다 구경 하다 하다 이상 하다 오다 심다 아침 나오다 오다 같다 경우 우려먹다 사진 찍다 귀찮다 귀엽다 작가 이큐 공룡 공룡 같다 다음 용소 내용 되다 있다 패스 여태 나오다 얄밉다 할인 받다 아기 집다 계산 되다 교보문고 깔다 드리다 서비스 온라인 결제 결제 내역 직원 보다 확인 드리다 이상 이상 리뷰"
"Blog_지름신_201701_2073","육아 쉬다 있다 틈새 여유 생기다 요리 발동 걸리다 있다 요즘 지름신 이것 수호신 강림 좋다 좋다 않다 외출 하다 무한 클릭 그리다 검색 무쇠 주물 최종 목적지 도달 사이즈 비하다 엄청나다 무게 길들이다 시간 하다 결국 구석탱이 가다 무한 검색 하다 알다 되다 그리다 그리다 후라이팬 몰다 이롭다 쇼핑 이롭다 쇼핑 오다 환영 가격 사이즈 색상 마음 들다 이거 결정 신혼 초기 코팅 알다 근래 세라믹 코팅 냄비 쓰다 보다 결과 좋다 없다 그리다 친환경 그리다 세라믹 민트 색이다 젊다 느낌 세라믹 코팅 되다 있다 깊이 좋다 예전 손잡이 고무 되다 제품 있다 올라오다 타다 갖다 버리다 라운드 그리다 손잡이 깔끔하다 이쁘다 요리 식탁 올리다 그릇 느낌 이쁘다 이롭다 쇼핑 컨셉 좋다 뉴스 보다 믿다 물티슈 에탄올 성분 기준치 이상 기사 보다 낫다 우리 키우다 사용 물티슈 쓰이다 코딩 좋다 이것 버리다 생각 늘리다 붙다 않다 좋다 생각 쓰다 라운드 그리다 그리다 사이즈 인덕션 되다 식탁 하다 먹다 좋다 키우다 이후 식탁 요리 하다 먹다 못하다 그리다 오븐 가능 가격 비하다 품질 보증 선하다 이롭다 없다 별점 아이 위하다 선택 그리다 에센셜 라운드 그리다 세계 세라믹 코팅 프라이팬 크리스피 요리 즐겁다 세라믹 코팅 후라이팬 굽다 먹다 하다 아래 라운드 그리다 먹다 싶다 희망 없다 한가하다 주말 오다"
"Blog_지름신_201701_2074","이번 패키지 칭호 나오다 마음속 있다 지름신 명하 지르다 결국 지르다 사다 버리다 후회 하다 않다 결국 사다 하다 동안 모으다 모으다 부케 아수라 털리다 모으다 이번 칭호 지르다 올해 에픽 기대 보다 좋다 힘내다 보다"
"Blog_지름신_201701_2077","꾸다 요새 열씨 하다 갖다 싶다 갖다 싶다 색연필 갖다 싶다 그러다 마카 갖다 싶다 나머지 사치 같다 많다 지다 필통 갖다 싶다 볼펜 보관함 사다 싶다 장비 있다 구비 하다 두다 지름신 돋다"
"Blog_지름신_201701_2081","공연 보다 하다 어제 근로 회식 넘나다 놀다 서울 가다 뒤집히다 알다 예당 도착 주변 하다 데스노트 보다 가다 지름신 발동 오다 필요 없다 표현력 좋다 감동 자리 중앙 보이다 정의 무엇 사랑 사랑 대단하다 없다 지다 누구 사랑 사랑 느낌 받다 무대 아름답다 목소리 흘러나오다 목소리 쩔다 이러다 있다 알다 보니다 주다 보다 벌어지다 혼자 감탄사 연발 목소리 듣다 원래 좋다 하다 보다 소름 노래 완전 온몸 노래 전율 시간 짧다 느끼다 지다 헤나 미사 위하다 노래 부르다 감정 전달 대박 오다 닿다 눈가 눈물 빨리다 들어가다 하다 테니스 재다 나다 죄인 죽이다 정의 구현 하다 하다 마지막 결국 라이토 의하다 마감 인간 욕심 없다 파멸 같다 라이토 라이토 라이토 터지다 하다 시끄럽다 하다 가지다 미사 있다 막다 고민 많다 라이토 이러다 마지막 커튼콜 인사 주다 흔들다 주다 한지상 마지막 시다 주다 인사 손짓 호응 크다 유도 시다 주다 크다 호응 가리키다 완전 데스노트 하다 모르다 덕분 새해 크다 감동 받다 가다 감사 안동 돌아가다 유후 마음속 라온"
"Blog_지름신_201701_2087","다육 정원 수련 복사 본문 기타 기능 번역 보다 수련 예전 분양 남다 알뜰 튼실하다 아이 착하다 팔다 품다 사진 실물 이쁘다 크기 생각 크다 깔끔하다 키우다 흔적 보이다 단아 수련 예전 아이 예쁘다 키우다 이쁘다 키우다 분지 하다 버리다 신상 들이다 겨울 베란다 들어오다 지름신 비다 있다 화분 많다 지다 예전 들이다 싶다 마음 없다 품다 좋다 같다"
"Blog_지름신_201701_2098","건강 지다 새해 다짐 건강 지다 다이어트 위젯 복사 본문 기타 기능 번역 보다 새해 다짐 건강 지다 다이어트 위젯 위젯 요거 페이스메이커 역할 하다 깨달음 위젯 만들다 다이어트 쉐이크 지름 지름신 오다 아깝다 작심 계획 세우다 건강 지다 첫걸음 크다 그림 아침 간단하다 음식 점심 아무거 먹다 직장인 어쩌다 없다 저녁 잇다 마시다 런닝 머신 시간 배고프다 저녁 간식 야채 스틱 요거 진행 보다 세부 내용 추후 필요시 진행 하다 설날 계획 잡다 무리수 싶다 시작 보다"
"Blog_지름신_201701_21","일상 뛰어넘다 일상 정리 보다 사진첩 정리 택배 보내다 나다 통보 전화 엄마 날씨 춥다 지다 세사 이불 보내다 주다 취향 존중 주다 엄마 하다 네이비 보내다 오다 사람 남자 사다 생각 정도 어둡다 하다 주말 아침 나다 나오다 명동 연말 분위기 명동 하다 가다 스타 벅스 있다 겨울 시즌 언니 오다 있다 파닭 맥주 처음 있다 포장 오다 먹다 꿀맛 여기 파닭 넘다 맛있다 간만 문화 생활 하다 도쿄 갔다오다 얼마 되다 이태원 있다 스탠드 샌드위치 어수선 포테이토 샌드위치 되다 그거 먹다 오다 아쉽다 대로 샌드위치 넘다 맛있다 한남동 걸다 가다 프렌즈 구경 한남동 있다 현대 카드 라이브러리 하다 레코드 좋다 모이다 하다 구경 하다 있다 턴테이블 갖다 싶다 시보 걸어가다 가을 가을 유아인 운영 스튜디오 콘크리트 줄리앙 전시회 하다 있다 쉬다 만큼 쉬다 전시 구경 하다 사람 많다 인증 찍다 편하다 사람 비키다 주다 이때 잠시 어울리다 크다 남자 이상 보다 공유 공유 오라버니 쩔다 출근 점심 시간 산책 의식 회사 슬리퍼 신고 스타 벅스 도장 찍다 패션 테러 시렵다 들어가다 귀찮다 저녁 퇴근 싫다 오뎅 사다 저녁 이거 근처 마트 걸어가다 고추장 불고기 사다 오다 도시락 반찬 만들다 저녁밥 해결 마트 상품권 쓰다 마음 먹다 이마트 장보기 평소 눈여기다 보다 웨이브 세일 평소 좋다 하다 세일 무엇 선택 깊다 고민 과다 욕심 지름신 오바 하다 들다 가다 상품 금액 초과 빼다 빼다 초과 결국 소비 지치다 먹다 물만두 비빔 급하다 만들다 먹다 생각 없다 빼빼 로데이 회사 쿠키 치다 점심 시간 올리브 디디 산책 두타 두산 선수 교보문고 들리다 강동원 나오다 하이 구매 아침 출근 퇴근 명동 촛불 집회 열리다 피곤 이끌다 동안 기르다 길다 머리 자르다 버리다 단발 단발 어색하다 이상 적응 되다 얼굴 하다 정도 이미지 바끼다 사람 전화 인증 보내다 주다 내일 위하다 의미 출근 새벽 마치다 가로수길 접선 아바타 되다 길치 지도 보다 모르다 도로 없다 어쩌다 단발 어색하다 하다 모르다 평소 찍다 셀카 표정 어울리다 어색하다 이상 돌아가다 창신동 들리다 족발 포장 다음 출근 점심 시간 가을 산책 춥다 퇴근 생각 오다 우리 있다 친구 챙기다 주다 있다 평일 누룽지 점심 시간 산책 하다 이상 퇴근 이태원 친구 오랜만 사랑 한남동 걸어가다 원인 밀리언 우리 목소리 완급 조절 실패 단발 어색하다 포기 않다 셀카 점심 시간 산책 디디 구경 사다 싶다 리스트 사진 남기다 두다 퇴근 영화 조정석 넘나다 밀리언 테이크아웃 친구 인증 예쁘다 쓰레기 모으다 취미 점심 시간 유니클로 세일 시작 사다 없다 걸어가다 다리 아프다 퇴근 내려가다 오랜만 남부 터미널 저녁 먹다 애매하다 바라 샌드위치"
"Blog_지름신_201701_2105","좋아하다 되다 지나다 가을 걷다 도로 따르다 놓이다 다육 구경 지름신 내려오다 그러다 다육 관하다 하다 초짜 없다 저희 다육 생활 넘다 하다 있다 처음 들이다 초저 다양 종류 다육 입맛 고르다 있다 장점 있다 때문 노랗다 화분 다육 딸아이 유치원 가져오다 제외 다육 가지다 오다 현재 없다 그것 처음 구입 주인 아주머니 그렇다 이상 주다 말다 다육 주다 쥐약 그러다 주다 않다 베트남 보름 다녀오다 하다 어머니 맡기다 나가다 그때 어머니 다육 주다 말다 귀띔 드리다 하다 깜빡하다 돌아오다 다육 보다 낙엽 되다 떨어지다 시작 떨어지다 의아 여쭈다 보다 화분 작다 주다 하다 자식 비명 소리 놀라다 주다 식물 없다 살아가다 없다 살아가다 없다 사실 식물 생육 적합 다육 같다 경우 최소한 필요 하다 식물 같다 이후 끊다 낙엽 지다 현상 이어지다 하다 녀석 고사 버리다 사진 다육 되살아나다 분재 하다 보다 좋다 하다 사간 형태 모양 않다 나오다 기쁘다 소식 고사 직전 가다 다육 가다 되살아나다 자리 새끼 치다 예쁘다 딸아이 유치원 가지다 오다 다육 새끼 치다 모양 유추 보다 지나다 가을 이사 오다 다육 저희 거실 적응 마치다 같다 다음 포스트 적응 이후 변화 되다 모습 그리다 보다 사업자 정보 표시 농원 정재완 경북 예천군 보문면 사업자 등록번호 통신 판매 신고 번호 호호 사이버 이용 약관 가다"
"Blog_지름신_201701_212","이야기 생기다 있다 복사 본문 기타 기능 번역 보다 생기다 좋다 하다 들어가다 버리다 모르다 기본 지르다 같다 이것 모르다 뽑다 위하다 이상 지르다 그러다 뽑다 나다 모르다 뿌다 하다 하다 주변 많다 지다 지름신 강림 많다 지다 느끼다 요즘"
"Blog_지름신_201701_2125","최근 복사 본문 기타 기능 번역 보다 새해맞이 동안 배우다 싶다 운동 시작 수영 전형 수영 초보 자라다 아무것 하다 모르다 어리다 친구 수영 배우다 엄마 체육관 보내다 주다 수영장 방콕 가다 처음 가다 보다 정도 사람 모른다 생존 위하다 배우다 되다 않다 싶다 용기 내다 동네 레포츠 센터 등록 동네 있다 지역 주민 할인 주다 소리 있다 그거 자유 수영 가능 강습 할인 하다 주다 하다 아쉽다 가다 임기 여성 할인 가다 있다 여자 자연 강림 며칠 강습 나오다 때문 부분 할인 하다 주다 같다 정도 강습 시간 자유 수영 가능 연습 가다 좋다 같다 가다 보다 하다 지나다 되다 미치다 지경 우리 동네 박태환 되다 그러다 운동 시작 지름신 오다 있다 같다 수영복 엄마 태국 가다 사다 원피스 수영복 입다 있다 가슴 패드 맞다 반신 수영복 입다 입다 원피스 삭다 반신 수영복 노리다 보다 수경 수모 쓰다 얼굴 자국 남다 그렇다 수영 나다 쿵푸팬더 나타나다 최근 사다 학교 공부 도움 되다 같다 구매 주다 구매 페이지 읽다 함정 읽다 나가다 최근 일상 수영 스터디 무대 인사 해진 태평 인성 보다 가다"
"Blog_지름신_201701_2126","전기장판 사다 가다 시티 센터 여자 친구 생일 선물 사다 주다 위하다 쇼핑 하다 춥다 날씨 자전거 타다 그렇다 고프다 하다 춥다 보이다 맥도날드 들어가다 세트 메뉴 주문 햄버거 세트 나오다 할인 빅맥 치즈 버거 기본 버거 세트 주문 적용 빅맥 할인 받다 여자 친구 고르다 우리나라 상하 스파이 버거 느낌 버거 그거 할인 되다 메뉴 같다 이것 상하이 스파이 버거 비슷하다 느낌 버거 스파이 마요네즈 소스 소스 가지 선택 있다 이것 빅맥 우리 나라 사이즈 작다 맛있다 맥도날드 식사 하다 여자 친구 선물 고르다 여자 친구 가지다 싶다 하다 무스탕 하다 쇼핑 센터 있다 매장 돌다 이쁘다 무스탕 없다 춥다 입다 오다 사다 입다 가다 갈아입다 이쁘다 하다 같다 득템 무스탕 어울리다 만하다 부츠 사다 가다 신발 얻다 세일 지름신 강림 사다 버리다 신고 다니다 운동 런닝 보다 구멍 나다 있다 바람 들어오다 빗물 들어오다 고생 하다 이것 사다 걱정 하다 되다 같다 저렴하다 사다 만족 이쁘다 뜨다 있다 자전거 내리다 찍다 여기 가깝다 느끼다 지다 밝다 크다 느끼다 지다 돌아오다 구매 정기 장판 침대 깔다 이거 까다 이불 시트 빼다 깔다 따뜻하다 녀석 느끼다 나서다 고생 잊다 사랑 이용 있다 녀석 이제 약하다 틀다 뜨겁다 정도 겨울 이기다 내다 돕다 주다 중요 친구 오늘 바쁘다 움직이다 의미 있다 하루 페이스북 페이지 해외 표류기 좋다 부탁드리다 주소 많다 편하다 소통 위하다 만들다 페이스북 페이지 질문 사항 기타 문의 이곳 하다 주다 빠르다 답변 받다 보다 있다 좋다 많다 공유 친구 소문 주세요 카카오스토리 트위터 페이스북 해외 연수 카테고리 아일랜드 어학 연수 아일랜드 먹다 아일랜드 어학 연수 원카드 게임 거래 채식 시작 아일랜드 어학 연수 맥도날드 쇼핑 전기장판 구매 아일랜드 어학 연수 아일랜드 휴일 아일랜드 첫눈 고양이 새집 카레 라이스 아일랜드 어학 연수 생일 파티 생일 케이크 식당 추천 아일랜드 치킨 아일랜드 어학 연수 아일랜드 전기 비다 미역국 끊이다 학원 이름 변경"
